post_id,body,added_by,date,user_closed,deleted
454,Suspendisse potenti. Cras in purus eu magna vulputate luctus.,20,2/5/2021,true,true
455,"Morbi ut odio. Cras mi pede, malesuada in, imperdiet et, commodo vulputate, justo.",22,3/6/2021,true,true
456,Vivamus in felis eu sapien cursus vestibulum. Proin eu mi. Nulla ac enim.,14,6/7/2021,false,false
457,Vivamus in felis eu sapien cursus vestibulum. Proin eu mi. Nulla ac enim.,17,7/8/2021,true,true
458,Nulla ac enim.,8,7/8/2021,true,true
459,"Vivamus vestibulum sagittis sapien. Cum sociis natoque penatibus et magnis dis parturient montes, nascetur ridiculus mus. Etiam vel augue.",11,7/17/2021,false,false
460,Nullam molestie nibh in lectus.,7,12/24/2021,false,false
461,Etiam pretium iaculis justo.,14,1/5/2021,true,true
462,Curabitur convallis. Duis consequat dui nec nisi volutpat eleifend. Donec ut dolor.,23,6/29/2021,true,true
463,"Integer pede justo, lacinia eget, tincidunt eget, tempus vel, pede. Morbi porttitor lorem id ligula. Suspendisse ornare consequat lectus.",12,4/18/2021,true,true
464,Donec ut dolor.,23,3/7/2021,true,false
465,Phasellus sit amet erat. Nulla tempus.,17,9/26/2021,false,false
466,Aliquam sit amet diam in magna bibendum imperdiet.,15,11/23/2021,false,true
467,Pellentesque viverra pede ac diam.,4,3/13/2021,false,true
468,Vestibulum ante ipsum primis in faucibus orci luctus et ultrices posuere cubilia Curae; Duis faucibus accumsan odio.,3,10/18/2021,true,true
469,Maecenas pulvinar lobortis est. Phasellus sit amet erat.,12,5/11/2021,true,false
470,"Cum sociis natoque penatibus et magnis dis parturient montes, nascetur ridiculus mus.",13,5/3/2021,false,false
471,"Morbi sem mauris, laoreet ut, rhoncus aliquet, pulvinar sed, nisl. Nunc rhoncus dui vel sem.",13,1/6/2021,false,true
472,Aliquam non mauris.,14,6/6/2021,true,true
473,"Maecenas leo odio, condimentum id, luctus nec, molestie sed, justo.",4,9/18/2021,true,false
474,"Curabitur in libero ut massa volutpat convallis. Morbi odio odio, elementum eu, interdum eu, tincidunt in, leo.",7,4/21/2021,true,false
475,Vivamus in felis eu sapien cursus vestibulum.,6,10/1/2021,false,false
476,"Integer aliquet, massa id lobortis convallis, tortor risus dapibus augue, vel accumsan tellus nisi eu orci. Mauris lacinia sapien quis libero.",4,8/24/2021,false,false
477,Curabitur gravida nisi at nibh. In hac habitasse platea dictumst.,24,2/11/2021,false,true
478,Vestibulum sed magna at nunc commodo placerat. Praesent blandit. Nam nulla.,4,12/19/2021,true,true
479,Vivamus in felis eu sapien cursus vestibulum. Proin eu mi.,15,11/21/2021,false,true
480,"Donec diam neque, vestibulum eget, vulputate ut, ultrices vel, augue. Vestibulum ante ipsum primis in faucibus orci luctus et ultrices posuere cubilia Curae; Donec pharetra, magna vestibulum aliquet ultrices, erat tortor sollicitudin mi, sit amet lobortis sapien sapien non mi. Integer ac neque.",14,11/7/2021,true,false
481,Pellentesque ultrices mattis odio.,1,11/26/2021,true,false
482,Integer non velit.,11,12/28/2020,false,true
483,"Proin interdum mauris non ligula pellentesque ultrices. Phasellus id sapien in sapien iaculis congue. Vivamus metus arcu, adipiscing molestie, hendrerit at, vulputate vitae, nisl.",8,4/8/2021,false,true
484,Nulla facilisi. Cras non velit nec nisi vulputate nonummy. Maecenas tincidunt lacus at velit.,8,7/16/2021,true,false
485,Nulla tellus.,21,2/10/2021,true,false
486,"Nullam orci pede, venenatis non, sodales sed, tincidunt eu, felis. Fusce posuere felis sed lacus. Morbi sem mauris, laoreet ut, rhoncus aliquet, pulvinar sed, nisl.",7,3/14/2021,true,false
487,"Maecenas leo odio, condimentum id, luctus nec, molestie sed, justo.",20,11/5/2021,false,true
488,Aliquam non mauris. Morbi non lectus.,13,7/2/2021,false,true
489,"Fusce lacus purus, aliquet at, feugiat non, pretium quis, lectus.",17,9/29/2021,false,true
490,In hac habitasse platea dictumst. Maecenas ut massa quis augue luctus tincidunt. Nulla mollis molestie lorem.,16,6/7/2021,true,true
491,Morbi a ipsum.,11,9/14/2021,true,false
492,In hac habitasse platea dictumst. Etiam faucibus cursus urna.,17,11/9/2021,false,true
493,"In hac habitasse platea dictumst. Aliquam augue quam, sollicitudin vitae, consectetuer eget, rutrum at, lorem.",23,10/3/2021,true,false
494,Nulla facilisi. Cras non velit nec nisi vulputate nonummy. Maecenas tincidunt lacus at velit.,5,1/1/2021,true,true
495,"Vestibulum quam sapien, varius ut, blandit non, interdum in, ante. Vestibulum ante ipsum primis in faucibus orci luctus et ultrices posuere cubilia Curae; Duis faucibus accumsan odio.",1,4/2/2021,false,false
496,Morbi non quam nec dui luctus rutrum.,5,1/28/2021,true,false
497,Aenean sit amet justo.,22,7/12/2021,true,true
498,Nunc purus. Phasellus in felis.,13,10/16/2021,true,true
499,Morbi vel lectus in quam fringilla rhoncus.,17,3/21/2021,true,true
500,Sed ante. Vivamus tortor.,5,12/4/2021,false,true
501,Morbi vel lectus in quam fringilla rhoncus.,8,10/2/2021,false,true
502,"Donec odio justo, sollicitudin ut, suscipit a, feugiat et, eros. Vestibulum ac est lacinia nisi venenatis tristique. Fusce congue, diam id ornare imperdiet, sapien urna pretium nisl, ut volutpat sapien arcu sed augue.",16,1/17/2021,true,false
503,In congue. Etiam justo.,22,1/6/2021,false,false
504,Nunc purus.,8,8/12/2021,false,true
505,"In est risus, auctor sed, tristique in, tempus sit amet, sem. Fusce consequat. Nulla nisl.",17,10/7/2021,true,false
506,"Integer non velit. Donec diam neque, vestibulum eget, vulputate ut, ultrices vel, augue.",19,5/13/2021,true,true
507,Nulla suscipit ligula in lacus. Curabitur at ipsum ac tellus semper interdum.,6,8/12/2021,false,true
508,Integer ac neque. Duis bibendum. Morbi non quam nec dui luctus rutrum.,24,7/20/2021,true,true
509,Morbi a ipsum. Integer a nibh. In quis justo.,12,5/13/2021,false,false
510,Nunc purus. Phasellus in felis.,1,7/25/2021,false,false
511,"Nam ultrices, libero non mattis pulvinar, nulla pede ullamcorper augue, a suscipit nulla elit ac nulla. Sed vel enim sit amet nunc viverra dapibus. Nulla suscipit ligula in lacus.",3,3/11/2021,false,true
512,Nunc nisl.,16,12/14/2021,true,false
513,"Lorem ipsum dolor sit amet, consectetuer adipiscing elit. Proin interdum mauris non ligula pellentesque ultrices. Phasellus id sapien in sapien iaculis congue.",5,4/7/2021,false,false
514,Aenean lectus.,12,2/14/2021,true,false
515,Quisque id justo sit amet sapien dignissim vestibulum. Vestibulum ante ipsum primis in faucibus orci luctus et ultrices posuere cubilia Curae; Nulla dapibus dolor vel est.,1,9/23/2021,false,true
516,Etiam pretium iaculis justo.,17,11/1/2021,false,false
517,"Lorem ipsum dolor sit amet, consectetuer adipiscing elit. Proin interdum mauris non ligula pellentesque ultrices.",1,6/2/2021,true,true
518,Morbi a ipsum. Integer a nibh.,17,8/23/2021,true,true
519,Pellentesque at nulla. Suspendisse potenti. Cras in purus eu magna vulputate luctus.,23,1/2/2021,true,true
520,"Donec ut mauris eget massa tempor convallis. Nulla neque libero, convallis eget, eleifend luctus, ultricies eu, nibh. Quisque id justo sit amet sapien dignissim vestibulum.",13,9/18/2021,true,true
521,Nullam varius. Nulla facilisi. Cras non velit nec nisi vulputate nonummy.,19,2/19/2021,true,false
522,Etiam faucibus cursus urna.,6,8/6/2021,false,false
523,Donec posuere metus vitae ipsum. Aliquam non mauris. Morbi non lectus.,8,7/11/2021,true,false
524,"Nam ultrices, libero non mattis pulvinar, nulla pede ullamcorper augue, a suscipit nulla elit ac nulla. Sed vel enim sit amet nunc viverra dapibus.",2,9/2/2021,false,false
525,"Mauris enim leo, rhoncus sed, vestibulum sit amet, cursus id, turpis. Integer aliquet, massa id lobortis convallis, tortor risus dapibus augue, vel accumsan tellus nisi eu orci.",24,9/27/2021,false,false
526,"Cum sociis natoque penatibus et magnis dis parturient montes, nascetur ridiculus mus. Vivamus vestibulum sagittis sapien. Cum sociis natoque penatibus et magnis dis parturient montes, nascetur ridiculus mus.",24,4/16/2021,false,true
527,"Integer aliquet, massa id lobortis convallis, tortor risus dapibus augue, vel accumsan tellus nisi eu orci.",21,12/24/2021,false,false
528,Morbi vel lectus in quam fringilla rhoncus.,20,10/8/2021,false,false
529,Nullam porttitor lacus at turpis.,2,9/10/2021,true,true
530,"Lorem ipsum dolor sit amet, consectetuer adipiscing elit.",1,3/8/2021,true,true
531,Pellentesque viverra pede ac diam.,18,4/11/2021,true,true
532,"Cum sociis natoque penatibus et magnis dis parturient montes, nascetur ridiculus mus. Etiam vel augue. Vestibulum rutrum rutrum neque.",8,1/4/2021,false,false
533,Pellentesque eget nunc.,8,12/10/2021,false,true
534,Vivamus tortor.,12,1/17/2021,true,false
535,"Cras pellentesque volutpat dui. Maecenas tristique, est et tempus semper, est quam pharetra magna, ac consequat metus sapien ut nunc.",4,1/15/2021,false,true
536,"In est risus, auctor sed, tristique in, tempus sit amet, sem. Fusce consequat.",3,4/9/2021,false,false
537,Morbi a ipsum. Integer a nibh.,1,1/30/2021,false,true
538,"Vivamus vestibulum sagittis sapien. Cum sociis natoque penatibus et magnis dis parturient montes, nascetur ridiculus mus.",23,6/3/2021,false,true
539,"Curabitur in libero ut massa volutpat convallis. Morbi odio odio, elementum eu, interdum eu, tincidunt in, leo.",2,2/5/2021,false,true
540,Proin interdum mauris non ligula pellentesque ultrices.,14,4/30/2021,true,false
541,Nam tristique tortor eu pede.,19,10/25/2021,false,true
542,Pellentesque ultrices mattis odio.,6,5/14/2021,true,false
543,"Proin interdum mauris non ligula pellentesque ultrices. Phasellus id sapien in sapien iaculis congue. Vivamus metus arcu, adipiscing molestie, hendrerit at, vulputate vitae, nisl.",3,2/13/2021,true,false
544,Nunc rhoncus dui vel sem.,19,10/9/2021,true,false
545,In congue. Etiam justo.,1,2/15/2021,false,true
546,"Morbi odio odio, elementum eu, interdum eu, tincidunt in, leo.",11,7/29/2021,true,true
547,Sed accumsan felis. Ut at dolor quis odio consequat varius.,14,8/8/2021,false,false
548,"Vivamus metus arcu, adipiscing molestie, hendrerit at, vulputate vitae, nisl. Aenean lectus. Pellentesque eget nunc.",7,2/4/2021,false,false
549,In sagittis dui vel nisl.,10,2/12/2021,false,false
550,Nulla ac enim.,18,6/12/2021,false,true
551,Nulla mollis molestie lorem. Quisque ut erat. Curabitur gravida nisi at nibh.,18,3/7/2021,true,true
552,"In tempor, turpis nec euismod scelerisque, quam turpis adipiscing lorem, vitae mattis nibh ligula nec sem.",8,5/5/2021,true,false
553,In eleifend quam a odio.,3,1/12/2021,true,true
554,Vestibulum ante ipsum primis in faucibus orci luctus et ultrices posuere cubilia Curae; Duis faucibus accumsan odio. Curabitur convallis.,11,7/15/2021,true,false
555,"Integer pede justo, lacinia eget, tincidunt eget, tempus vel, pede. Morbi porttitor lorem id ligula.",14,8/1/2021,false,true
556,"Quisque erat eros, viverra eget, congue eget, semper rutrum, nulla. Nunc purus.",9,5/22/2021,true,false
557,"Quisque porta volutpat erat. Quisque erat eros, viverra eget, congue eget, semper rutrum, nulla.",25,10/9/2021,false,true
558,Vestibulum ante ipsum primis in faucibus orci luctus et ultrices posuere cubilia Curae; Duis faucibus accumsan odio.,5,11/16/2021,true,false
559,Phasellus sit amet erat. Nulla tempus.,2,11/13/2021,true,true
560,"Vestibulum ac est lacinia nisi venenatis tristique. Fusce congue, diam id ornare imperdiet, sapien urna pretium nisl, ut volutpat sapien arcu sed augue. Aliquam erat volutpat.",1,9/5/2021,true,false
561,"Integer aliquet, massa id lobortis convallis, tortor risus dapibus augue, vel accumsan tellus nisi eu orci.",10,1/29/2021,false,true
562,Fusce consequat. Nulla nisl.,9,12/20/2021,false,false
563,Nulla nisl. Nunc nisl.,20,9/14/2021,true,true
564,"Aenean sit amet justo. Morbi ut odio. Cras mi pede, malesuada in, imperdiet et, commodo vulputate, justo.",12,6/23/2021,false,true
565,Curabitur at ipsum ac tellus semper interdum.,15,4/29/2021,true,true
566,Fusce consequat. Nulla nisl. Nunc nisl.,11,3/12/2021,true,false
567,Cras non velit nec nisi vulputate nonummy.,7,5/1/2021,true,true
568,"Nulla ac enim. In tempor, turpis nec euismod scelerisque, quam turpis adipiscing lorem, vitae mattis nibh ligula nec sem.",9,5/24/2021,true,true
569,Maecenas rhoncus aliquam lacus.,24,8/8/2021,true,false
570,Vestibulum ante ipsum primis in faucibus orci luctus et ultrices posuere cubilia Curae; Nulla dapibus dolor vel est.,4,11/5/2021,false,false
571,"Mauris ullamcorper purus sit amet nulla. Quisque arcu libero, rutrum ac, lobortis vel, dapibus at, diam. Nam tristique tortor eu pede.",14,12/2/2021,true,true
572,"Nunc nisl. Duis bibendum, felis sed interdum venenatis, turpis enim blandit mi, in porttitor pede justo eu massa. Donec dapibus.",18,2/17/2021,true,false
573,Curabitur convallis. Duis consequat dui nec nisi volutpat eleifend. Donec ut dolor.,3,12/25/2021,false,true
574,Ut tellus.,16,3/10/2021,false,false
575,"Nam nulla. Integer pede justo, lacinia eget, tincidunt eget, tempus vel, pede.",21,6/26/2021,false,false
576,Donec posuere metus vitae ipsum.,7,11/8/2021,true,true
577,Donec posuere metus vitae ipsum. Aliquam non mauris. Morbi non lectus.,25,3/10/2021,true,true
578,Integer a nibh. In quis justo. Maecenas rhoncus aliquam lacus.,14,1/22/2021,false,true
579,Integer ac neque.,17,3/17/2021,true,false
580,Cras pellentesque volutpat dui.,20,11/29/2021,false,false
581,Integer non velit.,14,4/17/2021,true,true
582,In hac habitasse platea dictumst.,20,7/28/2021,true,true
583,"Morbi vestibulum, velit id pretium iaculis, diam erat fermentum justo, nec condimentum neque sapien placerat ante. Nulla justo.",16,3/3/2021,true,true
584,"Nulla ac enim. In tempor, turpis nec euismod scelerisque, quam turpis adipiscing lorem, vitae mattis nibh ligula nec sem. Duis aliquam convallis nunc.",14,7/26/2021,true,false
585,"Vestibulum ac est lacinia nisi venenatis tristique. Fusce congue, diam id ornare imperdiet, sapien urna pretium nisl, ut volutpat sapien arcu sed augue.",15,10/29/2021,true,true
586,"Maecenas leo odio, condimentum id, luctus nec, molestie sed, justo.",3,12/8/2021,false,true
587,Sed ante.,13,11/22/2021,false,true
588,In quis justo.,18,12/3/2021,false,false
589,Etiam vel augue. Vestibulum rutrum rutrum neque.,20,9/10/2021,false,true
590,Vestibulum ante ipsum primis in faucibus orci luctus et ultrices posuere cubilia Curae; Mauris viverra diam vitae quam.,17,9/3/2021,false,false
591,"Proin leo odio, porttitor id, consequat in, consequat ut, nulla. Sed accumsan felis.",22,6/22/2021,false,false
592,"Maecenas tristique, est et tempus semper, est quam pharetra magna, ac consequat metus sapien ut nunc. Vestibulum ante ipsum primis in faucibus orci luctus et ultrices posuere cubilia Curae; Mauris viverra diam vitae quam. Suspendisse potenti.",10,12/11/2021,true,false
593,In eleifend quam a odio. In hac habitasse platea dictumst.,24,5/16/2021,true,true
594,Proin at turpis a pede posuere nonummy. Integer non velit.,17,1/3/2021,false,false
595,"Vestibulum ante ipsum primis in faucibus orci luctus et ultrices posuere cubilia Curae; Donec pharetra, magna vestibulum aliquet ultrices, erat tortor sollicitudin mi, sit amet lobortis sapien sapien non mi. Integer ac neque. Duis bibendum.",13,3/28/2021,true,false
596,Morbi non quam nec dui luctus rutrum.,14,12/25/2021,true,true
597,Proin risus.,20,6/29/2021,true,false
598,Cras non velit nec nisi vulputate nonummy. Maecenas tincidunt lacus at velit. Vivamus vel nulla eget eros elementum pellentesque.,15,7/29/2021,true,true
599,Proin interdum mauris non ligula pellentesque ultrices. Phasellus id sapien in sapien iaculis congue.,1,2/6/2021,false,false
600,Praesent lectus.,5,3/17/2021,true,true
601,In hac habitasse platea dictumst. Maecenas ut massa quis augue luctus tincidunt.,5,6/29/2021,false,false
602,Vestibulum ante ipsum primis in faucibus orci luctus et ultrices posuere cubilia Curae; Mauris viverra diam vitae quam.,15,12/31/2020,false,false
603,"Morbi sem mauris, laoreet ut, rhoncus aliquet, pulvinar sed, nisl. Nunc rhoncus dui vel sem.",20,7/27/2021,false,true
604,"Morbi vestibulum, velit id pretium iaculis, diam erat fermentum justo, nec condimentum neque sapien placerat ante.",15,10/3/2021,true,true
605,Sed vel enim sit amet nunc viverra dapibus. Nulla suscipit ligula in lacus.,4,3/28/2021,true,true
606,Etiam justo. Etiam pretium iaculis justo. In hac habitasse platea dictumst.,18,7/19/2021,false,true
607,In hac habitasse platea dictumst. Etiam faucibus cursus urna.,19,6/25/2021,false,true
608,Suspendisse potenti. Nullam porttitor lacus at turpis. Donec posuere metus vitae ipsum.,19,3/20/2021,false,true
609,Duis aliquam convallis nunc. Proin at turpis a pede posuere nonummy. Integer non velit.,25,7/31/2021,true,false
610,Nullam varius. Nulla facilisi.,17,11/16/2021,false,true
611,Sed vel enim sit amet nunc viverra dapibus.,15,4/2/2021,false,false
612,Fusce consequat.,11,5/5/2021,true,true
613,In sagittis dui vel nisl.,18,4/13/2021,false,false
614,"In hac habitasse platea dictumst. Aliquam augue quam, sollicitudin vitae, consectetuer eget, rutrum at, lorem. Integer tincidunt ante vel ipsum.",8,9/13/2021,true,true
615,Nullam sit amet turpis elementum ligula vehicula consequat.,8,10/29/2021,true,false
616,Donec posuere metus vitae ipsum. Aliquam non mauris.,7,7/5/2021,true,false
617,Ut at dolor quis odio consequat varius. Integer ac leo. Pellentesque ultrices mattis odio.,13,5/22/2021,true,false
618,Aliquam sit amet diam in magna bibendum imperdiet.,17,4/29/2021,true,true
619,"Morbi non lectus. Aliquam sit amet diam in magna bibendum imperdiet. Nullam orci pede, venenatis non, sodales sed, tincidunt eu, felis.",24,10/9/2021,true,true
620,"Duis at velit eu est congue elementum. In hac habitasse platea dictumst. Morbi vestibulum, velit id pretium iaculis, diam erat fermentum justo, nec condimentum neque sapien placerat ante.",23,10/3/2021,true,true
621,Praesent blandit lacinia erat.,15,1/31/2021,true,true
622,"In hac habitasse platea dictumst. Morbi vestibulum, velit id pretium iaculis, diam erat fermentum justo, nec condimentum neque sapien placerat ante.",14,6/3/2021,true,false
623,"Donec diam neque, vestibulum eget, vulputate ut, ultrices vel, augue.",22,2/21/2021,false,false
624,Maecenas pulvinar lobortis est. Phasellus sit amet erat. Nulla tempus.,3,9/8/2021,false,true
625,"Quisque porta volutpat erat. Quisque erat eros, viverra eget, congue eget, semper rutrum, nulla.",2,1/17/2021,false,true
626,"Aliquam sit amet diam in magna bibendum imperdiet. Nullam orci pede, venenatis non, sodales sed, tincidunt eu, felis. Fusce posuere felis sed lacus.",7,10/12/2021,true,true
627,Praesent id massa id nisl venenatis lacinia.,5,11/15/2021,true,true
628,Nulla tempus. Vivamus in felis eu sapien cursus vestibulum. Proin eu mi.,11,5/8/2021,true,true
629,Donec posuere metus vitae ipsum. Aliquam non mauris. Morbi non lectus.,5,1/21/2021,false,true
630,"Integer pede justo, lacinia eget, tincidunt eget, tempus vel, pede.",4,8/3/2021,true,false
631,Donec ut mauris eget massa tempor convallis.,3,2/13/2021,true,false
632,Maecenas ut massa quis augue luctus tincidunt.,11,9/3/2021,true,false
633,Maecenas ut massa quis augue luctus tincidunt. Nulla mollis molestie lorem.,3,3/10/2021,false,true
634,Pellentesque at nulla. Suspendisse potenti.,9,10/6/2021,true,false
635,Vivamus tortor. Duis mattis egestas metus.,10,1/9/2021,true,false
636,Morbi non quam nec dui luctus rutrum. Nulla tellus.,10,9/25/2021,true,false
637,Donec dapibus. Duis at velit eu est congue elementum. In hac habitasse platea dictumst.,25,1/9/2021,false,true
638,"In blandit ultrices enim. Lorem ipsum dolor sit amet, consectetuer adipiscing elit.",14,4/5/2021,false,false
639,"Vivamus metus arcu, adipiscing molestie, hendrerit at, vulputate vitae, nisl. Aenean lectus.",22,10/4/2021,false,true
640,Sed ante. Vivamus tortor. Duis mattis egestas metus.,13,3/15/2021,true,true
641,Nunc rhoncus dui vel sem.,8,2/26/2021,true,false
642,Vivamus vel nulla eget eros elementum pellentesque. Quisque porta volutpat erat.,11,2/26/2021,true,true
643,Nullam porttitor lacus at turpis. Donec posuere metus vitae ipsum. Aliquam non mauris.,20,1/14/2021,false,false
644,Nullam molestie nibh in lectus. Pellentesque at nulla. Suspendisse potenti.,3,12/22/2021,true,true
645,Ut tellus. Nulla ut erat id mauris vulputate elementum.,15,1/12/2021,false,false
646,Sed ante. Vivamus tortor.,16,7/22/2021,false,false
647,"Maecenas tristique, est et tempus semper, est quam pharetra magna, ac consequat metus sapien ut nunc.",11,4/22/2021,true,false
648,Maecenas tincidunt lacus at velit.,7,12/21/2021,false,true
649,Morbi a ipsum.,18,5/18/2021,true,false
650,"Nullam orci pede, venenatis non, sodales sed, tincidunt eu, felis. Fusce posuere felis sed lacus.",5,11/12/2021,false,true
651,"Morbi vestibulum, velit id pretium iaculis, diam erat fermentum justo, nec condimentum neque sapien placerat ante.",16,2/3/2021,true,false
652,Aenean lectus.,6,9/4/2021,true,false
653,Nunc rhoncus dui vel sem. Sed sagittis.,25,12/14/2021,false,true
654,Vivamus vestibulum sagittis sapien.,19,10/28/2021,false,true
655,Duis mattis egestas metus. Aenean fermentum. Donec ut mauris eget massa tempor convallis.,12,7/9/2021,false,true
656,Etiam faucibus cursus urna. Ut tellus. Nulla ut erat id mauris vulputate elementum.,2,7/13/2021,false,false
657,"Lorem ipsum dolor sit amet, consectetuer adipiscing elit. Proin risus. Praesent lectus.",20,10/22/2021,false,false
658,Nulla tempus. Vivamus in felis eu sapien cursus vestibulum.,19,1/6/2021,true,false
659,"Morbi vel lectus in quam fringilla rhoncus. Mauris enim leo, rhoncus sed, vestibulum sit amet, cursus id, turpis. Integer aliquet, massa id lobortis convallis, tortor risus dapibus augue, vel accumsan tellus nisi eu orci.",25,2/14/2021,false,false
660,In sagittis dui vel nisl. Duis ac nibh.,24,1/22/2021,false,false
661,"Sed sagittis. Nam congue, risus semper porta volutpat, quam pede lobortis ligula, sit amet eleifend pede libero quis orci. Nullam molestie nibh in lectus.",6,3/26/2021,false,false
662,Nullam molestie nibh in lectus. Pellentesque at nulla.,23,3/11/2021,true,false
663,Nullam porttitor lacus at turpis. Donec posuere metus vitae ipsum.,5,7/15/2021,true,true
664,In sagittis dui vel nisl. Duis ac nibh.,10,7/8/2021,false,true
665,In blandit ultrices enim.,1,7/5/2021,true,true
666,"Duis ac nibh. Fusce lacus purus, aliquet at, feugiat non, pretium quis, lectus.",7,8/5/2021,true,false
667,Mauris sit amet eros. Suspendisse accumsan tortor quis turpis. Sed ante.,1,1/22/2021,false,true
668,Praesent blandit lacinia erat. Vestibulum sed magna at nunc commodo placerat. Praesent blandit.,7,1/22/2021,false,false
669,"Cras mi pede, malesuada in, imperdiet et, commodo vulputate, justo. In blandit ultrices enim.",24,8/8/2021,true,false
670,In hac habitasse platea dictumst.,20,5/22/2021,true,true
671,Nulla justo. Aliquam quis turpis eget elit sodales scelerisque.,16,11/12/2021,true,true
672,Cras in purus eu magna vulputate luctus.,17,7/26/2021,false,true
673,Nulla justo. Aliquam quis turpis eget elit sodales scelerisque. Mauris sit amet eros.,2,8/18/2021,false,true
674,Etiam pretium iaculis justo.,18,3/25/2021,false,true
675,Nulla mollis molestie lorem. Quisque ut erat.,13,4/29/2021,true,true
676,Aenean auctor gravida sem.,9,1/26/2021,false,false
677,Aenean lectus. Pellentesque eget nunc.,15,2/18/2021,false,false
678,"Fusce posuere felis sed lacus. Morbi sem mauris, laoreet ut, rhoncus aliquet, pulvinar sed, nisl. Nunc rhoncus dui vel sem.",24,10/17/2021,true,true
679,Cras in purus eu magna vulputate luctus.,25,1/27/2021,true,true
680,Nulla suscipit ligula in lacus. Curabitur at ipsum ac tellus semper interdum.,2,4/18/2021,true,true
681,Nulla nisl. Nunc nisl.,12,9/11/2021,true,true
682,Duis bibendum. Morbi non quam nec dui luctus rutrum. Nulla tellus.,23,12/9/2021,false,false
683,"Morbi ut odio. Cras mi pede, malesuada in, imperdiet et, commodo vulputate, justo. In blandit ultrices enim.",16,1/30/2021,true,true
684,Pellentesque ultrices mattis odio. Donec vitae nisi.,8,3/12/2021,true,true
685,Fusce consequat. Nulla nisl. Nunc nisl.,10,6/6/2021,false,true
686,"In est risus, auctor sed, tristique in, tempus sit amet, sem. Fusce consequat. Nulla nisl.",10,8/30/2021,false,false
687,"Quisque erat eros, viverra eget, congue eget, semper rutrum, nulla.",10,7/31/2021,true,false
688,"Nulla nisl. Nunc nisl. Duis bibendum, felis sed interdum venenatis, turpis enim blandit mi, in porttitor pede justo eu massa.",20,9/12/2021,false,true
689,"Fusce lacus purus, aliquet at, feugiat non, pretium quis, lectus. Suspendisse potenti.",21,2/14/2021,false,false
690,Nulla tempus.,14,10/18/2021,true,false
691,Aliquam non mauris.,15,7/11/2021,true,false
692,"Suspendisse ornare consequat lectus. In est risus, auctor sed, tristique in, tempus sit amet, sem. Fusce consequat.",21,11/26/2021,true,false
693,"Donec odio justo, sollicitudin ut, suscipit a, feugiat et, eros.",22,9/25/2021,false,true
694,"Nam nulla. Integer pede justo, lacinia eget, tincidunt eget, tempus vel, pede. Morbi porttitor lorem id ligula.",7,3/20/2021,false,false
695,"Suspendisse ornare consequat lectus. In est risus, auctor sed, tristique in, tempus sit amet, sem.",15,2/9/2021,true,true
696,Nunc purus. Phasellus in felis. Donec semper sapien a libero.,20,11/18/2021,false,true
697,Suspendisse potenti. In eleifend quam a odio.,2,8/16/2021,true,true
698,Morbi non quam nec dui luctus rutrum.,8,8/31/2021,false,true
699,Morbi non lectus.,5,1/7/2021,false,true
700,Fusce consequat. Nulla nisl.,8,7/12/2021,false,false
701,In congue. Etiam justo.,3,7/10/2021,true,false
702,Morbi non quam nec dui luctus rutrum.,20,9/27/2021,true,true
703,Nulla facilisi.,16,8/10/2021,false,false
704,In congue. Etiam justo.,15,5/25/2021,true,true
705,Vestibulum rutrum rutrum neque. Aenean auctor gravida sem.,1,5/17/2021,false,false
706,Aliquam erat volutpat. In congue. Etiam justo.,14,11/19/2021,true,false
707,Aenean auctor gravida sem.,13,2/22/2021,false,true
