post_id,body,added_by,date,user_closed,deleted
226,Donec dapibus. Duis at velit eu est congue elementum. In hac habitasse platea dictumst.,11,7/4/2021,true,true
227,Nunc rhoncus dui vel sem. Sed sagittis.,5,6/23/2021,false,false
228,Quisque ut erat. Curabitur gravida nisi at nibh. In hac habitasse platea dictumst.,11,10/2/2021,true,true
229,"Maecenas rhoncus aliquam lacus. Morbi quis tortor id nulla ultrices aliquet. Maecenas leo odio, condimentum id, luctus nec, molestie sed, justo.",23,9/2/2021,false,true
230,"Integer aliquet, massa id lobortis convallis, tortor risus dapibus augue, vel accumsan tellus nisi eu orci. Mauris lacinia sapien quis libero.",21,9/8/2021,true,true
231,Morbi a ipsum. Integer a nibh.,21,4/1/2021,true,true
232,"Maecenas leo odio, condimentum id, luctus nec, molestie sed, justo. Pellentesque viverra pede ac diam. Cras pellentesque volutpat dui.",14,11/26/2021,false,true
233,Mauris lacinia sapien quis libero. Nullam sit amet turpis elementum ligula vehicula consequat.,25,12/29/2020,false,false
234,Ut tellus.,1,2/2/2021,true,true
235,"Vivamus metus arcu, adipiscing molestie, hendrerit at, vulputate vitae, nisl. Aenean lectus.",9,8/4/2021,false,true
236,Suspendisse potenti. Nullam porttitor lacus at turpis. Donec posuere metus vitae ipsum.,9,10/25/2021,false,true
237,"Donec odio justo, sollicitudin ut, suscipit a, feugiat et, eros. Vestibulum ac est lacinia nisi venenatis tristique.",25,8/19/2021,true,false
238,In congue.,3,10/31/2021,false,true
239,Morbi ut odio.,7,6/16/2021,true,true
240,"Vestibulum ante ipsum primis in faucibus orci luctus et ultrices posuere cubilia Curae; Donec pharetra, magna vestibulum aliquet ultrices, erat tortor sollicitudin mi, sit amet lobortis sapien sapien non mi. Integer ac neque. Duis bibendum.",5,3/19/2021,false,false
241,Morbi non quam nec dui luctus rutrum. Nulla tellus.,12,11/25/2021,true,true
242,Aenean lectus. Pellentesque eget nunc.,4,5/31/2021,false,false
243,"Fusce lacus purus, aliquet at, feugiat non, pretium quis, lectus. Suspendisse potenti. In eleifend quam a odio.",11,10/30/2021,false,false
244,Mauris lacinia sapien quis libero. Nullam sit amet turpis elementum ligula vehicula consequat.,24,3/10/2021,false,true
245,"Nullam orci pede, venenatis non, sodales sed, tincidunt eu, felis. Fusce posuere felis sed lacus.",1,7/31/2021,false,false
246,"In sagittis dui vel nisl. Duis ac nibh. Fusce lacus purus, aliquet at, feugiat non, pretium quis, lectus.",6,4/1/2021,false,false
247,Sed ante. Vivamus tortor. Duis mattis egestas metus.,9,2/12/2021,true,true
248,"Cras in purus eu magna vulputate luctus. Cum sociis natoque penatibus et magnis dis parturient montes, nascetur ridiculus mus.",18,8/2/2021,true,false
249,Curabitur at ipsum ac tellus semper interdum. Mauris ullamcorper purus sit amet nulla.,21,7/3/2021,false,true
250,Vivamus vestibulum sagittis sapien.,8,5/5/2021,true,false
251,Vestibulum ante ipsum primis in faucibus orci luctus et ultrices posuere cubilia Curae; Nulla dapibus dolor vel est.,15,1/8/2021,true,false
252,"Vivamus vestibulum sagittis sapien. Cum sociis natoque penatibus et magnis dis parturient montes, nascetur ridiculus mus.",3,1/14/2021,false,true
253,Proin interdum mauris non ligula pellentesque ultrices. Phasellus id sapien in sapien iaculis congue.,9,8/20/2021,false,false
254,Mauris sit amet eros. Suspendisse accumsan tortor quis turpis.,10,9/13/2021,true,false
255,Praesent id massa id nisl venenatis lacinia.,10,5/8/2021,true,true
256,"Aliquam augue quam, sollicitudin vitae, consectetuer eget, rutrum at, lorem.",2,1/30/2021,false,false
257,"Vivamus metus arcu, adipiscing molestie, hendrerit at, vulputate vitae, nisl.",7,11/28/2021,true,true
258,"Duis ac nibh. Fusce lacus purus, aliquet at, feugiat non, pretium quis, lectus. Suspendisse potenti.",17,9/13/2021,false,true
259,Aenean lectus. Pellentesque eget nunc.,18,12/14/2021,true,false
260,Donec dapibus.,21,6/3/2021,false,false
261,"Suspendisse ornare consequat lectus. In est risus, auctor sed, tristique in, tempus sit amet, sem. Fusce consequat.",19,2/17/2021,true,true
262,Praesent id massa id nisl venenatis lacinia. Aenean sit amet justo. Morbi ut odio.,19,4/16/2021,true,false
263,"Donec vitae nisi. Nam ultrices, libero non mattis pulvinar, nulla pede ullamcorper augue, a suscipit nulla elit ac nulla.",15,11/21/2021,true,false
264,"Lorem ipsum dolor sit amet, consectetuer adipiscing elit. Proin risus. Praesent lectus.",6,7/9/2021,false,false
265,Cras non velit nec nisi vulputate nonummy.,10,7/20/2021,true,false
266,Morbi a ipsum. Integer a nibh. In quis justo.,8,7/29/2021,false,false
267,"Cras mi pede, malesuada in, imperdiet et, commodo vulputate, justo. In blandit ultrices enim. Lorem ipsum dolor sit amet, consectetuer adipiscing elit.",2,10/4/2021,true,true
268,Suspendisse ornare consequat lectus.,7,3/18/2021,true,true
269,"Morbi vestibulum, velit id pretium iaculis, diam erat fermentum justo, nec condimentum neque sapien placerat ante. Nulla justo. Aliquam quis turpis eget elit sodales scelerisque.",12,3/11/2021,false,false
270,"Nam congue, risus semper porta volutpat, quam pede lobortis ligula, sit amet eleifend pede libero quis orci.",17,9/29/2021,false,false
271,Morbi quis tortor id nulla ultrices aliquet.,2,8/24/2021,false,true
272,Phasellus in felis. Donec semper sapien a libero. Nam dui.,23,6/17/2021,true,true
273,Duis bibendum. Morbi non quam nec dui luctus rutrum.,11,5/21/2021,false,false
274,Cras non velit nec nisi vulputate nonummy.,15,1/24/2021,true,true
275,Etiam pretium iaculis justo.,20,1/17/2021,false,false
276,In hac habitasse platea dictumst. Maecenas ut massa quis augue luctus tincidunt.,16,10/13/2021,false,false
277,"Donec odio justo, sollicitudin ut, suscipit a, feugiat et, eros.",13,12/19/2021,true,false
278,Etiam faucibus cursus urna. Ut tellus.,12,4/20/2021,true,false
279,"Donec diam neque, vestibulum eget, vulputate ut, ultrices vel, augue. Vestibulum ante ipsum primis in faucibus orci luctus et ultrices posuere cubilia Curae; Donec pharetra, magna vestibulum aliquet ultrices, erat tortor sollicitudin mi, sit amet lobortis sapien sapien non mi.",16,2/11/2021,true,true
280,Nulla justo. Aliquam quis turpis eget elit sodales scelerisque.,15,1/30/2021,true,false
281,"Cum sociis natoque penatibus et magnis dis parturient montes, nascetur ridiculus mus. Etiam vel augue. Vestibulum rutrum rutrum neque.",22,6/29/2021,false,true
282,"Morbi vel lectus in quam fringilla rhoncus. Mauris enim leo, rhoncus sed, vestibulum sit amet, cursus id, turpis. Integer aliquet, massa id lobortis convallis, tortor risus dapibus augue, vel accumsan tellus nisi eu orci.",10,7/2/2021,true,false
283,Aliquam erat volutpat. In congue. Etiam justo.,17,3/19/2021,true,true
284,Vivamus in felis eu sapien cursus vestibulum. Proin eu mi. Nulla ac enim.,7,7/6/2021,true,false
285,"In est risus, auctor sed, tristique in, tempus sit amet, sem. Fusce consequat.",4,6/17/2021,false,true
286,Nullam porttitor lacus at turpis. Donec posuere metus vitae ipsum.,17,12/26/2021,false,false
287,Nulla justo.,22,10/24/2021,false,true
288,Nullam sit amet turpis elementum ligula vehicula consequat. Morbi a ipsum. Integer a nibh.,8,2/6/2021,true,false
289,In hac habitasse platea dictumst.,23,4/16/2021,true,false
290,"Nulla neque libero, convallis eget, eleifend luctus, ultricies eu, nibh. Quisque id justo sit amet sapien dignissim vestibulum. Vestibulum ante ipsum primis in faucibus orci luctus et ultrices posuere cubilia Curae; Nulla dapibus dolor vel est.",9,5/11/2021,false,false
291,Morbi ut odio.,16,4/3/2021,true,true
292,"Vestibulum quam sapien, varius ut, blandit non, interdum in, ante. Vestibulum ante ipsum primis in faucibus orci luctus et ultrices posuere cubilia Curae; Duis faucibus accumsan odio. Curabitur convallis.",7,11/2/2021,false,true
293,"Quisque porta volutpat erat. Quisque erat eros, viverra eget, congue eget, semper rutrum, nulla.",10,2/13/2021,true,false
294,"Integer aliquet, massa id lobortis convallis, tortor risus dapibus augue, vel accumsan tellus nisi eu orci. Mauris lacinia sapien quis libero.",19,4/17/2021,true,false
295,"Nam nulla. Integer pede justo, lacinia eget, tincidunt eget, tempus vel, pede.",21,12/17/2021,false,false
296,Nulla tellus. In sagittis dui vel nisl. Duis ac nibh.,23,10/5/2021,false,true
297,Proin interdum mauris non ligula pellentesque ultrices.,7,5/29/2021,true,true
298,Proin interdum mauris non ligula pellentesque ultrices. Phasellus id sapien in sapien iaculis congue.,2,5/30/2021,true,true
299,Aenean fermentum. Donec ut mauris eget massa tempor convallis.,6,9/25/2021,false,true
300,"Maecenas leo odio, condimentum id, luctus nec, molestie sed, justo. Pellentesque viverra pede ac diam. Cras pellentesque volutpat dui.",20,3/17/2021,false,true
301,Duis ac nibh.,2,9/6/2021,false,true
302,Morbi porttitor lorem id ligula.,18,11/1/2021,true,true
303,"Morbi ut odio. Cras mi pede, malesuada in, imperdiet et, commodo vulputate, justo. In blandit ultrices enim.",8,8/6/2021,true,true
304,"Cras in purus eu magna vulputate luctus. Cum sociis natoque penatibus et magnis dis parturient montes, nascetur ridiculus mus. Vivamus vestibulum sagittis sapien.",6,1/26/2021,true,true
305,Donec vitae nisi.,10,6/18/2021,false,false
306,Pellentesque at nulla. Suspendisse potenti.,14,7/28/2021,false,true
307,Phasellus in felis. Donec semper sapien a libero. Nam dui.,16,7/19/2021,false,true
308,"Cum sociis natoque penatibus et magnis dis parturient montes, nascetur ridiculus mus. Vivamus vestibulum sagittis sapien. Cum sociis natoque penatibus et magnis dis parturient montes, nascetur ridiculus mus.",25,7/29/2021,true,false
309,Curabitur at ipsum ac tellus semper interdum. Mauris ullamcorper purus sit amet nulla.,6,11/2/2021,false,false
310,Morbi non lectus. Aliquam sit amet diam in magna bibendum imperdiet.,13,1/15/2021,false,true
311,Sed sagittis.,11,6/9/2021,false,true
312,Vivamus vel nulla eget eros elementum pellentesque. Quisque porta volutpat erat.,14,11/19/2021,true,false
313,"Morbi vestibulum, velit id pretium iaculis, diam erat fermentum justo, nec condimentum neque sapien placerat ante. Nulla justo. Aliquam quis turpis eget elit sodales scelerisque.",17,12/26/2021,false,true
314,Pellentesque viverra pede ac diam.,7,10/4/2021,true,false
315,"In blandit ultrices enim. Lorem ipsum dolor sit amet, consectetuer adipiscing elit.",1,4/22/2021,false,true
316,Curabitur at ipsum ac tellus semper interdum.,9,1/26/2021,false,false
317,Integer a nibh.,3,12/17/2021,false,true
318,"Vivamus vestibulum sagittis sapien. Cum sociis natoque penatibus et magnis dis parturient montes, nascetur ridiculus mus. Etiam vel augue.",1,6/21/2021,true,true
319,Vestibulum ante ipsum primis in faucibus orci luctus et ultrices posuere cubilia Curae; Mauris viverra diam vitae quam. Suspendisse potenti. Nullam porttitor lacus at turpis.,17,4/12/2021,false,true
320,"Mauris ullamcorper purus sit amet nulla. Quisque arcu libero, rutrum ac, lobortis vel, dapibus at, diam.",9,8/15/2021,true,false
321,Nulla suscipit ligula in lacus.,24,8/14/2021,false,true
322,Etiam pretium iaculis justo.,20,10/27/2021,false,true
323,Pellentesque at nulla. Suspendisse potenti. Cras in purus eu magna vulputate luctus.,23,4/17/2021,false,true
324,In hac habitasse platea dictumst.,9,3/18/2021,false,false
325,Pellentesque ultrices mattis odio.,17,5/14/2021,false,true
326,In quis justo.,1,12/26/2021,true,false
327,Mauris sit amet eros. Suspendisse accumsan tortor quis turpis. Sed ante.,8,10/31/2021,true,true
328,Curabitur gravida nisi at nibh. In hac habitasse platea dictumst.,6,5/26/2021,false,false
329,Vestibulum ante ipsum primis in faucibus orci luctus et ultrices posuere cubilia Curae; Nulla dapibus dolor vel est.,1,9/7/2021,false,true
330,Nulla ut erat id mauris vulputate elementum. Nullam varius. Nulla facilisi.,22,8/22/2021,true,false
331,"Proin eu mi. Nulla ac enim. In tempor, turpis nec euismod scelerisque, quam turpis adipiscing lorem, vitae mattis nibh ligula nec sem.",5,9/26/2021,true,true
332,In hac habitasse platea dictumst. Etiam faucibus cursus urna. Ut tellus.,21,1/3/2021,false,false
333,"In tempor, turpis nec euismod scelerisque, quam turpis adipiscing lorem, vitae mattis nibh ligula nec sem. Duis aliquam convallis nunc.",16,2/8/2021,false,false
334,Morbi ut odio.,14,7/27/2021,true,false
335,"Integer pede justo, lacinia eget, tincidunt eget, tempus vel, pede. Morbi porttitor lorem id ligula. Suspendisse ornare consequat lectus.",5,10/23/2021,true,true
336,Vivamus in felis eu sapien cursus vestibulum. Proin eu mi.,16,6/26/2021,true,true
337,"Praesent lectus. Vestibulum quam sapien, varius ut, blandit non, interdum in, ante. Vestibulum ante ipsum primis in faucibus orci luctus et ultrices posuere cubilia Curae; Duis faucibus accumsan odio.",2,9/5/2021,false,true
338,In hac habitasse platea dictumst.,7,3/27/2021,true,true
339,Integer ac leo. Pellentesque ultrices mattis odio. Donec vitae nisi.,15,8/5/2021,true,false
340,Etiam pretium iaculis justo. In hac habitasse platea dictumst.,3,8/10/2021,true,false
341,Nulla nisl. Nunc nisl.,5,5/15/2021,false,true
342,Nulla nisl.,24,7/18/2021,true,false
343,Morbi porttitor lorem id ligula. Suspendisse ornare consequat lectus.,6,5/10/2021,false,true
344,Nullam varius.,20,5/13/2021,true,false
345,In eleifend quam a odio. In hac habitasse platea dictumst.,22,2/22/2021,false,false
346,Suspendisse potenti. Cras in purus eu magna vulputate luctus.,9,8/12/2021,true,false
347,Duis mattis egestas metus.,9,7/20/2021,true,true
348,"Morbi vestibulum, velit id pretium iaculis, diam erat fermentum justo, nec condimentum neque sapien placerat ante.",25,5/15/2021,true,false
349,Vestibulum sed magna at nunc commodo placerat. Praesent blandit. Nam nulla.,4,5/10/2021,true,true
350,Morbi a ipsum. Integer a nibh. In quis justo.,22,10/5/2021,false,true
351,"Nulla neque libero, convallis eget, eleifend luctus, ultricies eu, nibh. Quisque id justo sit amet sapien dignissim vestibulum. Vestibulum ante ipsum primis in faucibus orci luctus et ultrices posuere cubilia Curae; Nulla dapibus dolor vel est.",13,4/12/2021,false,true
352,Praesent blandit lacinia erat.,23,8/24/2021,false,false
353,"In tempor, turpis nec euismod scelerisque, quam turpis adipiscing lorem, vitae mattis nibh ligula nec sem. Duis aliquam convallis nunc. Proin at turpis a pede posuere nonummy.",6,6/9/2021,true,true
354,"Nam ultrices, libero non mattis pulvinar, nulla pede ullamcorper augue, a suscipit nulla elit ac nulla. Sed vel enim sit amet nunc viverra dapibus. Nulla suscipit ligula in lacus.",10,5/27/2021,true,true
355,Duis mattis egestas metus. Aenean fermentum.,3,3/21/2021,false,true
356,Vestibulum ante ipsum primis in faucibus orci luctus et ultrices posuere cubilia Curae; Nulla dapibus dolor vel est.,2,6/13/2021,false,true
357,"Nulla neque libero, convallis eget, eleifend luctus, ultricies eu, nibh.",13,7/6/2021,false,false
358,"Integer pede justo, lacinia eget, tincidunt eget, tempus vel, pede. Morbi porttitor lorem id ligula. Suspendisse ornare consequat lectus.",4,9/5/2021,false,true
359,"Mauris ullamcorper purus sit amet nulla. Quisque arcu libero, rutrum ac, lobortis vel, dapibus at, diam. Nam tristique tortor eu pede.",20,9/4/2021,true,false
360,"Nunc nisl. Duis bibendum, felis sed interdum venenatis, turpis enim blandit mi, in porttitor pede justo eu massa. Donec dapibus.",21,6/9/2021,false,false
361,"Cum sociis natoque penatibus et magnis dis parturient montes, nascetur ridiculus mus. Vivamus vestibulum sagittis sapien. Cum sociis natoque penatibus et magnis dis parturient montes, nascetur ridiculus mus.",11,9/12/2021,true,false
362,"Fusce congue, diam id ornare imperdiet, sapien urna pretium nisl, ut volutpat sapien arcu sed augue. Aliquam erat volutpat.",4,10/25/2021,false,false
363,"Curabitur in libero ut massa volutpat convallis. Morbi odio odio, elementum eu, interdum eu, tincidunt in, leo.",1,6/6/2021,false,false
364,"Cum sociis natoque penatibus et magnis dis parturient montes, nascetur ridiculus mus. Etiam vel augue. Vestibulum rutrum rutrum neque.",25,12/16/2021,false,false
365,"Nulla neque libero, convallis eget, eleifend luctus, ultricies eu, nibh. Quisque id justo sit amet sapien dignissim vestibulum. Vestibulum ante ipsum primis in faucibus orci luctus et ultrices posuere cubilia Curae; Nulla dapibus dolor vel est.",1,1/18/2021,false,false
366,Aliquam quis turpis eget elit sodales scelerisque.,19,7/4/2021,true,false
367,Duis consequat dui nec nisi volutpat eleifend.,22,6/12/2021,true,false
368,"Proin leo odio, porttitor id, consequat in, consequat ut, nulla. Sed accumsan felis. Ut at dolor quis odio consequat varius.",2,1/17/2021,true,false
369,Morbi non lectus. Aliquam sit amet diam in magna bibendum imperdiet.,9,8/26/2021,false,false
370,Mauris sit amet eros.,1,1/21/2021,true,true
371,"Integer aliquet, massa id lobortis convallis, tortor risus dapibus augue, vel accumsan tellus nisi eu orci. Mauris lacinia sapien quis libero. Nullam sit amet turpis elementum ligula vehicula consequat.",10,6/8/2021,true,false
372,Vivamus tortor. Duis mattis egestas metus. Aenean fermentum.,19,1/10/2021,false,false
373,Donec dapibus.,1,5/13/2021,true,false
374,"Phasellus id sapien in sapien iaculis congue. Vivamus metus arcu, adipiscing molestie, hendrerit at, vulputate vitae, nisl. Aenean lectus.",7,7/14/2021,false,false
375,Duis bibendum. Morbi non quam nec dui luctus rutrum. Nulla tellus.,14,3/8/2021,false,false
376,Cras in purus eu magna vulputate luctus.,9,11/15/2021,false,false
377,Phasellus id sapien in sapien iaculis congue.,19,10/12/2021,true,false
378,Vestibulum sed magna at nunc commodo placerat. Praesent blandit.,3,1/28/2021,false,true
379,"Nulla neque libero, convallis eget, eleifend luctus, ultricies eu, nibh. Quisque id justo sit amet sapien dignissim vestibulum. Vestibulum ante ipsum primis in faucibus orci luctus et ultrices posuere cubilia Curae; Nulla dapibus dolor vel est.",16,8/20/2021,true,false
380,"Morbi porttitor lorem id ligula. Suspendisse ornare consequat lectus. In est risus, auctor sed, tristique in, tempus sit amet, sem.",10,9/28/2021,false,true
381,"Nulla neque libero, convallis eget, eleifend luctus, ultricies eu, nibh. Quisque id justo sit amet sapien dignissim vestibulum. Vestibulum ante ipsum primis in faucibus orci luctus et ultrices posuere cubilia Curae; Nulla dapibus dolor vel est.",13,1/26/2021,false,true
382,Nulla ut erat id mauris vulputate elementum. Nullam varius. Nulla facilisi.,23,2/20/2021,true,false
383,"Morbi porttitor lorem id ligula. Suspendisse ornare consequat lectus. In est risus, auctor sed, tristique in, tempus sit amet, sem.",15,3/25/2021,false,false
384,Nulla tempus. Vivamus in felis eu sapien cursus vestibulum. Proin eu mi.,5,3/3/2021,false,true
385,Vestibulum rutrum rutrum neque. Aenean auctor gravida sem. Praesent id massa id nisl venenatis lacinia.,24,8/28/2021,true,true
386,"In est risus, auctor sed, tristique in, tempus sit amet, sem. Fusce consequat. Nulla nisl.",24,1/24/2021,false,true
387,In hac habitasse platea dictumst.,12,11/7/2021,false,true
388,"Cum sociis natoque penatibus et magnis dis parturient montes, nascetur ridiculus mus. Etiam vel augue.",3,12/11/2021,false,false
389,Duis at velit eu est congue elementum.,20,10/3/2021,false,true
390,Maecenas rhoncus aliquam lacus. Morbi quis tortor id nulla ultrices aliquet.,4,5/29/2021,true,false
391,Etiam justo. Etiam pretium iaculis justo.,4,9/2/2021,true,true
392,"Nam congue, risus semper porta volutpat, quam pede lobortis ligula, sit amet eleifend pede libero quis orci. Nullam molestie nibh in lectus.",17,5/5/2021,false,true
393,Aliquam non mauris.,23,12/8/2021,false,false
394,Praesent blandit. Nam nulla.,22,8/7/2021,false,false
395,"In hac habitasse platea dictumst. Aliquam augue quam, sollicitudin vitae, consectetuer eget, rutrum at, lorem. Integer tincidunt ante vel ipsum.",6,4/18/2021,true,true
396,Suspendisse potenti.,10,5/16/2021,true,true
397,Curabitur convallis.,5,9/1/2021,false,false
398,Morbi non quam nec dui luctus rutrum. Nulla tellus. In sagittis dui vel nisl.,4,5/30/2021,true,true
399,"Phasellus id sapien in sapien iaculis congue. Vivamus metus arcu, adipiscing molestie, hendrerit at, vulputate vitae, nisl.",3,4/16/2021,false,true
400,Vestibulum ante ipsum primis in faucibus orci luctus et ultrices posuere cubilia Curae; Duis faucibus accumsan odio. Curabitur convallis. Duis consequat dui nec nisi volutpat eleifend.,8,6/19/2021,false,true
401,"Cras mi pede, malesuada in, imperdiet et, commodo vulputate, justo. In blandit ultrices enim.",4,6/29/2021,true,true
402,Duis at velit eu est congue elementum. In hac habitasse platea dictumst.,12,12/30/2020,true,false
403,Fusce consequat.,12,5/16/2021,true,false
404,In congue.,18,12/3/2021,false,true
405,"Nam congue, risus semper porta volutpat, quam pede lobortis ligula, sit amet eleifend pede libero quis orci.",15,7/13/2021,true,true
406,Vestibulum rutrum rutrum neque. Aenean auctor gravida sem. Praesent id massa id nisl venenatis lacinia.,19,10/25/2021,false,false
407,Morbi a ipsum. Integer a nibh.,9,7/27/2021,true,true
408,"Morbi odio odio, elementum eu, interdum eu, tincidunt in, leo. Maecenas pulvinar lobortis est. Phasellus sit amet erat.",4,1/7/2021,true,true
409,Ut at dolor quis odio consequat varius. Integer ac leo.,13,9/4/2021,true,false
410,Nulla tellus. In sagittis dui vel nisl. Duis ac nibh.,10,7/20/2021,false,false
411,"In hac habitasse platea dictumst. Morbi vestibulum, velit id pretium iaculis, diam erat fermentum justo, nec condimentum neque sapien placerat ante. Nulla justo.",4,12/12/2021,false,false
412,Morbi non lectus. Aliquam sit amet diam in magna bibendum imperdiet.,3,12/24/2021,false,true
413,Nulla tellus. In sagittis dui vel nisl. Duis ac nibh.,5,7/14/2021,true,false
414,Nulla facilisi. Cras non velit nec nisi vulputate nonummy.,9,12/18/2021,true,false
415,Nullam sit amet turpis elementum ligula vehicula consequat.,2,12/15/2021,false,false
416,Donec dapibus. Duis at velit eu est congue elementum.,17,6/26/2021,true,false
417,Nullam porttitor lacus at turpis.,7,2/17/2021,true,true
418,Morbi vel lectus in quam fringilla rhoncus.,2,8/24/2021,true,true
419,Pellentesque ultrices mattis odio.,1,3/18/2021,false,true
420,Duis consequat dui nec nisi volutpat eleifend. Donec ut dolor.,2,9/19/2021,false,false
421,"In blandit ultrices enim. Lorem ipsum dolor sit amet, consectetuer adipiscing elit. Proin interdum mauris non ligula pellentesque ultrices.",23,9/12/2021,true,true
422,Nunc purus. Phasellus in felis. Donec semper sapien a libero.,25,7/21/2021,false,false
423,Maecenas tincidunt lacus at velit. Vivamus vel nulla eget eros elementum pellentesque.,4,6/1/2021,true,true
424,"Donec ut mauris eget massa tempor convallis. Nulla neque libero, convallis eget, eleifend luctus, ultricies eu, nibh. Quisque id justo sit amet sapien dignissim vestibulum.",16,4/13/2021,true,true
425,Nullam sit amet turpis elementum ligula vehicula consequat.,6,12/16/2021,false,true
426,"Nulla neque libero, convallis eget, eleifend luctus, ultricies eu, nibh.",5,9/14/2021,true,false
427,Vivamus tortor. Duis mattis egestas metus. Aenean fermentum.,17,10/26/2021,false,false
428,Fusce consequat. Nulla nisl.,3,1/3/2021,true,false
429,Donec posuere metus vitae ipsum. Aliquam non mauris.,18,9/3/2021,false,true
430,Nullam porttitor lacus at turpis.,17,10/10/2021,true,true
431,Phasellus in felis. Donec semper sapien a libero. Nam dui.,23,6/14/2021,false,true
432,Cras pellentesque volutpat dui.,18,10/2/2021,true,false
433,Vivamus in felis eu sapien cursus vestibulum. Proin eu mi. Nulla ac enim.,9,9/18/2021,true,true
434,Vestibulum rutrum rutrum neque.,5,8/1/2021,true,true
435,"Curabitur at ipsum ac tellus semper interdum. Mauris ullamcorper purus sit amet nulla. Quisque arcu libero, rutrum ac, lobortis vel, dapibus at, diam.",11,11/3/2021,true,true
436,Nullam sit amet turpis elementum ligula vehicula consequat. Morbi a ipsum. Integer a nibh.,16,7/28/2021,true,false
437,Pellentesque at nulla. Suspendisse potenti.,10,3/2/2021,true,true
438,Donec quis orci eget orci vehicula condimentum. Curabitur in libero ut massa volutpat convallis.,16,5/20/2021,false,true
439,"Morbi vestibulum, velit id pretium iaculis, diam erat fermentum justo, nec condimentum neque sapien placerat ante. Nulla justo.",18,3/22/2021,true,false
440,Nulla facilisi.,3,10/3/2021,false,false
441,"Integer non velit. Donec diam neque, vestibulum eget, vulputate ut, ultrices vel, augue. Vestibulum ante ipsum primis in faucibus orci luctus et ultrices posuere cubilia Curae; Donec pharetra, magna vestibulum aliquet ultrices, erat tortor sollicitudin mi, sit amet lobortis sapien sapien non mi.",1,1/3/2021,true,true
442,Integer ac leo. Pellentesque ultrices mattis odio.,12,3/8/2021,false,true
443,"Morbi quis tortor id nulla ultrices aliquet. Maecenas leo odio, condimentum id, luctus nec, molestie sed, justo. Pellentesque viverra pede ac diam.",25,5/10/2021,true,false
444,In hac habitasse platea dictumst. Maecenas ut massa quis augue luctus tincidunt. Nulla mollis molestie lorem.,2,10/24/2021,false,true
445,Donec ut dolor.,21,6/6/2021,true,false
446,Maecenas rhoncus aliquam lacus. Morbi quis tortor id nulla ultrices aliquet.,24,6/19/2021,false,false
447,Ut at dolor quis odio consequat varius.,10,8/28/2021,true,true
448,Nunc purus. Phasellus in felis. Donec semper sapien a libero.,25,5/31/2021,true,false
449,"Suspendisse ornare consequat lectus. In est risus, auctor sed, tristique in, tempus sit amet, sem. Fusce consequat.",24,5/24/2021,false,false
450,"Maecenas rhoncus aliquam lacus. Morbi quis tortor id nulla ultrices aliquet. Maecenas leo odio, condimentum id, luctus nec, molestie sed, justo.",25,1/21/2021,false,true
451,Etiam vel augue. Vestibulum rutrum rutrum neque.,13,12/23/2021,true,false
452,"Vivamus metus arcu, adipiscing molestie, hendrerit at, vulputate vitae, nisl.",2,8/28/2021,true,true
453,Vestibulum sed magna at nunc commodo placerat. Praesent blandit. Nam nulla.,7,1/24/2021,true,false
