post_id,body,added_by,date,user_closed,deleted
708,Suspendisse potenti.,5,1/26/2021,false,false
709,"In est risus, auctor sed, tristique in, tempus sit amet, sem. Fusce consequat. Nulla nisl.",18,1/11/2021,false,true
710,"Integer pede justo, lacinia eget, tincidunt eget, tempus vel, pede. Morbi porttitor lorem id ligula.",11,8/15/2021,false,false
711,Aenean auctor gravida sem. Praesent id massa id nisl venenatis lacinia. Aenean sit amet justo.,17,12/18/2021,false,false
712,"Nunc rhoncus dui vel sem. Sed sagittis. Nam congue, risus semper porta volutpat, quam pede lobortis ligula, sit amet eleifend pede libero quis orci.",16,12/13/2021,true,false
713,Mauris sit amet eros.,6,5/4/2021,false,false
714,In quis justo.,17,1/24/2021,true,false
715,Duis bibendum. Morbi non quam nec dui luctus rutrum.,4,1/9/2021,true,true
716,Fusce consequat. Nulla nisl. Nunc nisl.,11,12/3/2021,false,false
717,Fusce consequat. Nulla nisl.,19,8/2/2021,true,true
718,Nullam molestie nibh in lectus.,10,3/4/2021,false,true
719,Fusce consequat. Nulla nisl. Nunc nisl.,6,10/6/2021,true,true
720,Pellentesque eget nunc.,17,12/1/2021,false,false
721,"Nulla nisl. Nunc nisl. Duis bibendum, felis sed interdum venenatis, turpis enim blandit mi, in porttitor pede justo eu massa.",23,11/30/2021,false,true
722,Ut at dolor quis odio consequat varius. Integer ac leo.,24,5/18/2021,true,false
723,Curabitur convallis.,16,11/15/2021,false,true
724,Donec ut mauris eget massa tempor convallis.,12,2/8/2021,false,false
725,Phasellus sit amet erat. Nulla tempus. Vivamus in felis eu sapien cursus vestibulum.,17,12/11/2021,true,false
726,Vivamus tortor. Duis mattis egestas metus. Aenean fermentum.,13,8/24/2021,true,true
727,"Nam congue, risus semper porta volutpat, quam pede lobortis ligula, sit amet eleifend pede libero quis orci. Nullam molestie nibh in lectus. Pellentesque at nulla.",15,9/27/2021,true,true
728,In hac habitasse platea dictumst. Maecenas ut massa quis augue luctus tincidunt.,5,10/8/2021,false,false
729,Praesent blandit lacinia erat.,6,5/6/2021,false,false
730,Praesent id massa id nisl venenatis lacinia. Aenean sit amet justo. Morbi ut odio.,24,10/18/2021,false,false
731,Ut tellus.,5,1/15/2021,false,true
732,Phasellus sit amet erat.,12,6/17/2021,true,true
733,"Donec vitae nisi. Nam ultrices, libero non mattis pulvinar, nulla pede ullamcorper augue, a suscipit nulla elit ac nulla.",9,7/1/2021,false,false
734,Proin risus.,10,4/15/2021,false,false
735,In hac habitasse platea dictumst. Etiam faucibus cursus urna.,5,10/2/2021,true,true
736,Nullam varius. Nulla facilisi.,5,7/12/2021,true,false
737,"In tempor, turpis nec euismod scelerisque, quam turpis adipiscing lorem, vitae mattis nibh ligula nec sem. Duis aliquam convallis nunc.",6,7/25/2021,true,true
738,Curabitur gravida nisi at nibh. In hac habitasse platea dictumst.,4,3/3/2021,true,true
739,Donec quis orci eget orci vehicula condimentum.,13,9/4/2021,false,false
740,"Nulla nisl. Nunc nisl. Duis bibendum, felis sed interdum venenatis, turpis enim blandit mi, in porttitor pede justo eu massa.",22,6/24/2021,false,false
741,Duis bibendum.,1,8/30/2021,true,true
742,Aenean auctor gravida sem. Praesent id massa id nisl venenatis lacinia. Aenean sit amet justo.,4,10/29/2021,true,true
743,Suspendisse potenti. Nullam porttitor lacus at turpis. Donec posuere metus vitae ipsum.,7,5/24/2021,true,true
744,"Nulla nisl. Nunc nisl. Duis bibendum, felis sed interdum venenatis, turpis enim blandit mi, in porttitor pede justo eu massa.",23,10/4/2021,false,true
745,"In sagittis dui vel nisl. Duis ac nibh. Fusce lacus purus, aliquet at, feugiat non, pretium quis, lectus.",24,1/3/2021,true,true
746,"Curabitur gravida nisi at nibh. In hac habitasse platea dictumst. Aliquam augue quam, sollicitudin vitae, consectetuer eget, rutrum at, lorem.",21,11/2/2021,false,true
747,"Integer non velit. Donec diam neque, vestibulum eget, vulputate ut, ultrices vel, augue.",4,8/6/2021,true,false
748,In blandit ultrices enim.,16,3/25/2021,true,true
749,"Curabitur in libero ut massa volutpat convallis. Morbi odio odio, elementum eu, interdum eu, tincidunt in, leo.",16,10/27/2021,false,false
750,"Sed sagittis. Nam congue, risus semper porta volutpat, quam pede lobortis ligula, sit amet eleifend pede libero quis orci. Nullam molestie nibh in lectus.",9,5/28/2021,false,true
751,"Nulla neque libero, convallis eget, eleifend luctus, ultricies eu, nibh.",21,11/24/2021,false,true
752,"Nam ultrices, libero non mattis pulvinar, nulla pede ullamcorper augue, a suscipit nulla elit ac nulla.",16,10/23/2021,true,true
753,"Integer aliquet, massa id lobortis convallis, tortor risus dapibus augue, vel accumsan tellus nisi eu orci. Mauris lacinia sapien quis libero. Nullam sit amet turpis elementum ligula vehicula consequat.",2,9/15/2021,false,true
754,Nulla nisl. Nunc nisl.,24,12/14/2021,false,false
755,"Morbi ut odio. Cras mi pede, malesuada in, imperdiet et, commodo vulputate, justo.",25,9/2/2021,true,true
756,"Cras pellentesque volutpat dui. Maecenas tristique, est et tempus semper, est quam pharetra magna, ac consequat metus sapien ut nunc.",17,12/1/2021,false,true
757,Phasellus in felis. Donec semper sapien a libero. Nam dui.,17,10/30/2021,true,false
758,Aliquam sit amet diam in magna bibendum imperdiet.,2,6/6/2021,true,true
759,"Nunc nisl. Duis bibendum, felis sed interdum venenatis, turpis enim blandit mi, in porttitor pede justo eu massa.",3,6/6/2021,true,true
760,Integer non velit.,7,6/11/2021,true,false
761,"Vivamus vel nulla eget eros elementum pellentesque. Quisque porta volutpat erat. Quisque erat eros, viverra eget, congue eget, semper rutrum, nulla.",13,3/27/2021,true,true
762,Phasellus sit amet erat. Nulla tempus.,3,3/4/2021,true,true
763,"In hac habitasse platea dictumst. Aliquam augue quam, sollicitudin vitae, consectetuer eget, rutrum at, lorem.",2,5/1/2021,false,false
764,Fusce consequat. Nulla nisl.,11,8/20/2021,true,false
765,"Donec ut mauris eget massa tempor convallis. Nulla neque libero, convallis eget, eleifend luctus, ultricies eu, nibh.",1,3/10/2021,false,true
766,"Morbi sem mauris, laoreet ut, rhoncus aliquet, pulvinar sed, nisl. Nunc rhoncus dui vel sem.",22,10/2/2021,true,true
767,Nunc purus. Phasellus in felis. Donec semper sapien a libero.,19,4/23/2021,true,false
768,Nulla justo. Aliquam quis turpis eget elit sodales scelerisque. Mauris sit amet eros.,1,3/13/2021,true,true
769,"Maecenas leo odio, condimentum id, luctus nec, molestie sed, justo.",8,7/15/2021,false,true
770,Praesent id massa id nisl venenatis lacinia. Aenean sit amet justo.,23,3/8/2021,false,false
771,Nulla ac enim.,14,8/6/2021,false,false
772,"Nam congue, risus semper porta volutpat, quam pede lobortis ligula, sit amet eleifend pede libero quis orci.",21,1/9/2021,true,false
773,Donec dapibus.,15,9/23/2021,true,true
774,"Morbi vel lectus in quam fringilla rhoncus. Mauris enim leo, rhoncus sed, vestibulum sit amet, cursus id, turpis. Integer aliquet, massa id lobortis convallis, tortor risus dapibus augue, vel accumsan tellus nisi eu orci.",8,6/8/2021,false,true
775,"Suspendisse ornare consequat lectus. In est risus, auctor sed, tristique in, tempus sit amet, sem.",3,8/25/2021,false,true
776,Donec quis orci eget orci vehicula condimentum. Curabitur in libero ut massa volutpat convallis.,17,4/23/2021,false,false
777,Maecenas ut massa quis augue luctus tincidunt. Nulla mollis molestie lorem.,2,6/4/2021,true,false
778,"Morbi non lectus. Aliquam sit amet diam in magna bibendum imperdiet. Nullam orci pede, venenatis non, sodales sed, tincidunt eu, felis.",10,3/28/2021,false,false
779,"In blandit ultrices enim. Lorem ipsum dolor sit amet, consectetuer adipiscing elit. Proin interdum mauris non ligula pellentesque ultrices.",3,6/25/2021,true,true
780,Duis consequat dui nec nisi volutpat eleifend.,19,8/23/2021,true,true
781,"Vestibulum ante ipsum primis in faucibus orci luctus et ultrices posuere cubilia Curae; Nulla dapibus dolor vel est. Donec odio justo, sollicitudin ut, suscipit a, feugiat et, eros.",22,9/8/2021,true,false
782,Aliquam non mauris. Morbi non lectus.,15,1/12/2021,false,true
783,In sagittis dui vel nisl. Duis ac nibh.,12,6/30/2021,false,true
784,"Nunc nisl. Duis bibendum, felis sed interdum venenatis, turpis enim blandit mi, in porttitor pede justo eu massa.",13,4/1/2021,true,false
785,Proin interdum mauris non ligula pellentesque ultrices. Phasellus id sapien in sapien iaculis congue.,10,7/28/2021,false,true
786,Donec posuere metus vitae ipsum. Aliquam non mauris. Morbi non lectus.,9,3/24/2021,false,false
787,Duis bibendum. Morbi non quam nec dui luctus rutrum. Nulla tellus.,24,10/18/2021,false,true
788,Nullam molestie nibh in lectus.,7,1/23/2021,false,true
789,Quisque porta volutpat erat.,25,1/30/2021,false,false
790,"In tempor, turpis nec euismod scelerisque, quam turpis adipiscing lorem, vitae mattis nibh ligula nec sem. Duis aliquam convallis nunc. Proin at turpis a pede posuere nonummy.",9,5/21/2021,true,true
791,Ut at dolor quis odio consequat varius. Integer ac leo. Pellentesque ultrices mattis odio.,17,6/14/2021,true,true
792,"Cum sociis natoque penatibus et magnis dis parturient montes, nascetur ridiculus mus. Vivamus vestibulum sagittis sapien.",14,9/5/2021,true,true
793,"Duis ac nibh. Fusce lacus purus, aliquet at, feugiat non, pretium quis, lectus.",15,6/20/2021,true,false
794,Duis consequat dui nec nisi volutpat eleifend.,9,3/20/2021,false,true
795,Nullam molestie nibh in lectus.,18,4/5/2021,false,true
796,Fusce consequat.,13,8/7/2021,true,true
797,"Cum sociis natoque penatibus et magnis dis parturient montes, nascetur ridiculus mus. Vivamus vestibulum sagittis sapien.",18,1/21/2021,true,false
798,Nulla justo. Aliquam quis turpis eget elit sodales scelerisque.,5,5/1/2021,false,true
799,Cras non velit nec nisi vulputate nonummy.,6,4/6/2021,false,true
800,Praesent blandit. Nam nulla.,3,10/3/2021,true,true
801,"Fusce posuere felis sed lacus. Morbi sem mauris, laoreet ut, rhoncus aliquet, pulvinar sed, nisl.",12,6/17/2021,true,false
802,"Vivamus vel nulla eget eros elementum pellentesque. Quisque porta volutpat erat. Quisque erat eros, viverra eget, congue eget, semper rutrum, nulla.",18,2/3/2021,true,true
803,Integer ac leo.,11,5/27/2021,true,false
804,Nulla tempus.,1,9/19/2021,false,true
805,Sed vel enim sit amet nunc viverra dapibus. Nulla suscipit ligula in lacus.,20,2/2/2021,false,false
806,"Cras mi pede, malesuada in, imperdiet et, commodo vulputate, justo. In blandit ultrices enim. Lorem ipsum dolor sit amet, consectetuer adipiscing elit.",13,1/17/2021,false,false
807,Nulla mollis molestie lorem. Quisque ut erat. Curabitur gravida nisi at nibh.,15,7/22/2021,false,false
808,Duis mattis egestas metus. Aenean fermentum. Donec ut mauris eget massa tempor convallis.,24,8/13/2021,true,true
809,"Nam ultrices, libero non mattis pulvinar, nulla pede ullamcorper augue, a suscipit nulla elit ac nulla. Sed vel enim sit amet nunc viverra dapibus. Nulla suscipit ligula in lacus.",4,4/12/2021,false,true
810,Morbi non lectus.,10,8/13/2021,false,true
811,Nunc purus.,6,12/19/2021,true,true
812,Nunc nisl.,25,1/31/2021,false,true
813,"Nunc nisl. Duis bibendum, felis sed interdum venenatis, turpis enim blandit mi, in porttitor pede justo eu massa.",18,10/24/2021,false,true
814,In eleifend quam a odio.,2,11/29/2021,true,false
815,"Aenean sit amet justo. Morbi ut odio. Cras mi pede, malesuada in, imperdiet et, commodo vulputate, justo.",8,5/30/2021,false,false
816,Phasellus in felis. Donec semper sapien a libero.,20,4/25/2021,true,false
817,"Morbi ut odio. Cras mi pede, malesuada in, imperdiet et, commodo vulputate, justo. In blandit ultrices enim.",15,8/18/2021,true,true
818,"Cras in purus eu magna vulputate luctus. Cum sociis natoque penatibus et magnis dis parturient montes, nascetur ridiculus mus.",5,12/14/2021,true,true
819,"Nullam orci pede, venenatis non, sodales sed, tincidunt eu, felis. Fusce posuere felis sed lacus. Morbi sem mauris, laoreet ut, rhoncus aliquet, pulvinar sed, nisl.",10,6/30/2021,true,true
820,"In hac habitasse platea dictumst. Morbi vestibulum, velit id pretium iaculis, diam erat fermentum justo, nec condimentum neque sapien placerat ante. Nulla justo.",1,10/25/2021,true,true
821,"Morbi sem mauris, laoreet ut, rhoncus aliquet, pulvinar sed, nisl.",22,12/2/2021,false,false
822,Phasellus sit amet erat. Nulla tempus. Vivamus in felis eu sapien cursus vestibulum.,18,8/22/2021,true,false
823,Aenean lectus. Pellentesque eget nunc.,18,11/16/2021,true,true
824,Aenean auctor gravida sem. Praesent id massa id nisl venenatis lacinia.,4,8/19/2021,false,false
825,Cras pellentesque volutpat dui.,18,10/5/2021,false,false
826,Aliquam quis turpis eget elit sodales scelerisque.,16,11/19/2021,false,false
827,Curabitur gravida nisi at nibh.,17,12/18/2021,false,false
828,"Duis bibendum, felis sed interdum venenatis, turpis enim blandit mi, in porttitor pede justo eu massa. Donec dapibus. Duis at velit eu est congue elementum.",10,10/5/2021,false,false
829,Ut at dolor quis odio consequat varius.,18,12/14/2021,true,false
830,"Nam dui. Proin leo odio, porttitor id, consequat in, consequat ut, nulla. Sed accumsan felis.",21,7/11/2021,false,false
831,"Donec diam neque, vestibulum eget, vulputate ut, ultrices vel, augue.",25,3/26/2021,false,true
832,Duis mattis egestas metus. Aenean fermentum.,10,5/5/2021,true,true
833,"Suspendisse ornare consequat lectus. In est risus, auctor sed, tristique in, tempus sit amet, sem.",16,9/27/2021,true,true
834,"Mauris ullamcorper purus sit amet nulla. Quisque arcu libero, rutrum ac, lobortis vel, dapibus at, diam.",3,12/10/2021,true,true
835,Maecenas pulvinar lobortis est.,19,4/15/2021,false,true
836,"Proin eu mi. Nulla ac enim. In tempor, turpis nec euismod scelerisque, quam turpis adipiscing lorem, vitae mattis nibh ligula nec sem.",20,3/28/2021,true,false
837,"Vivamus metus arcu, adipiscing molestie, hendrerit at, vulputate vitae, nisl. Aenean lectus.",23,2/20/2021,false,true
838,"Nunc nisl. Duis bibendum, felis sed interdum venenatis, turpis enim blandit mi, in porttitor pede justo eu massa. Donec dapibus.",12,11/6/2021,false,false
839,Nulla facilisi. Cras non velit nec nisi vulputate nonummy.,7,11/28/2021,false,false
840,Vivamus tortor. Duis mattis egestas metus.,21,7/11/2021,false,true
841,"Proin leo odio, porttitor id, consequat in, consequat ut, nulla. Sed accumsan felis. Ut at dolor quis odio consequat varius.",23,12/20/2021,true,false
842,"Duis bibendum, felis sed interdum venenatis, turpis enim blandit mi, in porttitor pede justo eu massa. Donec dapibus.",18,12/16/2021,true,false
843,"Morbi odio odio, elementum eu, interdum eu, tincidunt in, leo. Maecenas pulvinar lobortis est. Phasellus sit amet erat.",5,5/9/2021,false,false
844,"Morbi vestibulum, velit id pretium iaculis, diam erat fermentum justo, nec condimentum neque sapien placerat ante. Nulla justo. Aliquam quis turpis eget elit sodales scelerisque.",24,7/6/2021,false,true
845,"Vivamus vestibulum sagittis sapien. Cum sociis natoque penatibus et magnis dis parturient montes, nascetur ridiculus mus. Etiam vel augue.",21,3/7/2021,true,false
846,Suspendisse accumsan tortor quis turpis.,21,2/25/2021,true,false
847,Praesent id massa id nisl venenatis lacinia. Aenean sit amet justo. Morbi ut odio.,18,10/20/2021,true,true
848,Vivamus tortor.,2,5/28/2021,true,true
849,Nullam molestie nibh in lectus. Pellentesque at nulla.,9,2/27/2021,false,true
850,Sed accumsan felis.,18,9/4/2021,false,false
851,Quisque porta volutpat erat.,4,10/9/2021,true,true
852,Aenean lectus. Pellentesque eget nunc. Donec quis orci eget orci vehicula condimentum.,3,12/26/2021,true,true
853,Morbi a ipsum. Integer a nibh. In quis justo.,8,1/2/2021,false,true
854,"Maecenas tristique, est et tempus semper, est quam pharetra magna, ac consequat metus sapien ut nunc.",12,6/4/2021,true,true
855,"Mauris ullamcorper purus sit amet nulla. Quisque arcu libero, rutrum ac, lobortis vel, dapibus at, diam.",24,7/7/2021,true,false
856,Etiam faucibus cursus urna. Ut tellus. Nulla ut erat id mauris vulputate elementum.,2,11/22/2021,false,true
857,Vestibulum sed magna at nunc commodo placerat. Praesent blandit. Nam nulla.,20,3/14/2021,true,true
858,"Morbi odio odio, elementum eu, interdum eu, tincidunt in, leo. Maecenas pulvinar lobortis est. Phasellus sit amet erat.",16,7/3/2021,false,false
859,Vivamus tortor. Duis mattis egestas metus.,2,12/16/2021,false,true
860,Nullam porttitor lacus at turpis.,20,10/5/2021,true,false
861,Aliquam non mauris.,25,8/3/2021,false,false
862,"Nunc rhoncus dui vel sem. Sed sagittis. Nam congue, risus semper porta volutpat, quam pede lobortis ligula, sit amet eleifend pede libero quis orci.",16,1/23/2021,true,true
863,Pellentesque ultrices mattis odio. Donec vitae nisi.,16,4/18/2021,false,true
864,Donec ut dolor.,20,7/28/2021,true,false
865,Duis consequat dui nec nisi volutpat eleifend. Donec ut dolor.,4,4/26/2021,true,false
866,Nunc nisl.,25,1/16/2021,true,false
867,Morbi non lectus. Aliquam sit amet diam in magna bibendum imperdiet.,7,2/15/2021,true,false
868,Morbi ut odio.,18,8/6/2021,true,true
869,Proin interdum mauris non ligula pellentesque ultrices. Phasellus id sapien in sapien iaculis congue.,6,4/20/2021,true,false
870,Aliquam non mauris. Morbi non lectus. Aliquam sit amet diam in magna bibendum imperdiet.,11,9/12/2021,false,false
871,"Nullam orci pede, venenatis non, sodales sed, tincidunt eu, felis.",24,9/3/2021,true,false
872,Nulla tempus. Vivamus in felis eu sapien cursus vestibulum. Proin eu mi.,25,8/15/2021,true,true
873,Nulla suscipit ligula in lacus.,11,6/12/2021,false,false
874,Morbi quis tortor id nulla ultrices aliquet.,1,7/21/2021,true,true
875,"Lorem ipsum dolor sit amet, consectetuer adipiscing elit. Proin risus. Praesent lectus.",11,6/19/2021,false,true
876,Mauris lacinia sapien quis libero.,5,3/24/2021,false,false
877,"Integer aliquet, massa id lobortis convallis, tortor risus dapibus augue, vel accumsan tellus nisi eu orci. Mauris lacinia sapien quis libero.",2,8/1/2021,false,false
878,Phasellus in felis. Donec semper sapien a libero.,8,6/9/2021,true,true
879,Phasellus in felis.,21,9/3/2021,true,true
880,Morbi non lectus. Aliquam sit amet diam in magna bibendum imperdiet.,24,6/10/2021,true,true
881,Nulla mollis molestie lorem.,3,12/22/2021,false,false
882,Etiam vel augue.,10,11/10/2021,true,true
883,Pellentesque eget nunc.,4,6/7/2021,false,false
884,"Morbi sem mauris, laoreet ut, rhoncus aliquet, pulvinar sed, nisl. Nunc rhoncus dui vel sem. Sed sagittis.",20,4/19/2021,true,true
885,In hac habitasse platea dictumst. Etiam faucibus cursus urna.,4,2/5/2021,false,false
886,Morbi vel lectus in quam fringilla rhoncus.,2,6/9/2021,true,true
887,Mauris sit amet eros.,18,4/5/2021,false,false
888,"Curabitur gravida nisi at nibh. In hac habitasse platea dictumst. Aliquam augue quam, sollicitudin vitae, consectetuer eget, rutrum at, lorem.",25,11/7/2021,false,false
889,"Duis ac nibh. Fusce lacus purus, aliquet at, feugiat non, pretium quis, lectus. Suspendisse potenti.",17,3/2/2021,true,true
890,Duis bibendum.,16,12/21/2021,true,false
891,"Quisque porta volutpat erat. Quisque erat eros, viverra eget, congue eget, semper rutrum, nulla. Nunc purus.",22,8/29/2021,true,false
892,"Donec quis orci eget orci vehicula condimentum. Curabitur in libero ut massa volutpat convallis. Morbi odio odio, elementum eu, interdum eu, tincidunt in, leo.",20,1/16/2021,false,false
893,"Lorem ipsum dolor sit amet, consectetuer adipiscing elit.",18,2/8/2021,false,false
894,Integer a nibh. In quis justo.,22,12/12/2021,false,true
895,"Nulla neque libero, convallis eget, eleifend luctus, ultricies eu, nibh.",2,3/13/2021,true,false
896,"In blandit ultrices enim. Lorem ipsum dolor sit amet, consectetuer adipiscing elit.",5,4/23/2021,false,true
897,"Lorem ipsum dolor sit amet, consectetuer adipiscing elit.",10,11/23/2021,true,false
898,Vestibulum ante ipsum primis in faucibus orci luctus et ultrices posuere cubilia Curae; Nulla dapibus dolor vel est.,4,2/13/2021,false,true
899,Aliquam non mauris.,18,12/9/2021,true,true
900,Donec semper sapien a libero.,7,8/16/2021,true,true
901,In congue.,3,1/20/2021,false,false
902,Donec dapibus. Duis at velit eu est congue elementum. In hac habitasse platea dictumst.,16,3/21/2021,true,true
903,Pellentesque at nulla. Suspendisse potenti.,10,3/15/2021,false,false
904,"Aliquam sit amet diam in magna bibendum imperdiet. Nullam orci pede, venenatis non, sodales sed, tincidunt eu, felis.",8,6/5/2021,true,false
905,Donec ut dolor. Morbi vel lectus in quam fringilla rhoncus.,1,5/23/2021,true,false
906,"In est risus, auctor sed, tristique in, tempus sit amet, sem. Fusce consequat. Nulla nisl.",11,12/2/2021,false,true
907,Suspendisse potenti.,6,4/7/2021,false,false
908,Cras pellentesque volutpat dui.,17,4/21/2021,true,true
909,Integer ac neque.,8,6/12/2021,true,true
910,"Donec diam neque, vestibulum eget, vulputate ut, ultrices vel, augue. Vestibulum ante ipsum primis in faucibus orci luctus et ultrices posuere cubilia Curae; Donec pharetra, magna vestibulum aliquet ultrices, erat tortor sollicitudin mi, sit amet lobortis sapien sapien non mi. Integer ac neque.",19,12/13/2021,false,false
911,Nam nulla.,25,4/4/2021,true,false
912,Vivamus in felis eu sapien cursus vestibulum. Proin eu mi.,17,9/4/2021,true,false
913,"Morbi sem mauris, laoreet ut, rhoncus aliquet, pulvinar sed, nisl. Nunc rhoncus dui vel sem. Sed sagittis.",23,5/16/2021,false,false
914,Duis mattis egestas metus. Aenean fermentum.,13,5/9/2021,true,false
915,Etiam pretium iaculis justo.,17,6/17/2021,false,false
916,"Nulla neque libero, convallis eget, eleifend luctus, ultricies eu, nibh.",9,6/21/2021,true,false
917,"Cum sociis natoque penatibus et magnis dis parturient montes, nascetur ridiculus mus. Vivamus vestibulum sagittis sapien. Cum sociis natoque penatibus et magnis dis parturient montes, nascetur ridiculus mus.",17,8/7/2021,true,false
918,Duis bibendum. Morbi non quam nec dui luctus rutrum.,15,8/20/2021,true,true
919,"Maecenas tristique, est et tempus semper, est quam pharetra magna, ac consequat metus sapien ut nunc. Vestibulum ante ipsum primis in faucibus orci luctus et ultrices posuere cubilia Curae; Mauris viverra diam vitae quam.",14,11/6/2021,true,false
920,"Nam congue, risus semper porta volutpat, quam pede lobortis ligula, sit amet eleifend pede libero quis orci.",2,6/28/2021,false,false
921,"Cras in purus eu magna vulputate luctus. Cum sociis natoque penatibus et magnis dis parturient montes, nascetur ridiculus mus.",9,3/27/2021,false,true
922,Sed vel enim sit amet nunc viverra dapibus.,22,12/15/2021,true,false
923,Fusce posuere felis sed lacus.,9,11/20/2021,true,false
924,"Morbi vel lectus in quam fringilla rhoncus. Mauris enim leo, rhoncus sed, vestibulum sit amet, cursus id, turpis.",22,9/11/2021,true,false
925,Integer ac neque.,21,5/5/2021,false,false
926,Nulla suscipit ligula in lacus. Curabitur at ipsum ac tellus semper interdum.,24,9/26/2021,true,true
927,Vestibulum sed magna at nunc commodo placerat. Praesent blandit.,24,4/7/2021,true,true
928,Sed vel enim sit amet nunc viverra dapibus. Nulla suscipit ligula in lacus.,5,9/6/2021,false,false
929,Morbi quis tortor id nulla ultrices aliquet.,8,3/26/2021,false,true
930,Maecenas tincidunt lacus at velit.,16,9/13/2021,false,false
931,Vivamus vestibulum sagittis sapien.,15,7/6/2021,true,true
932,In quis justo.,14,11/21/2021,false,false
933,"Sed sagittis. Nam congue, risus semper porta volutpat, quam pede lobortis ligula, sit amet eleifend pede libero quis orci.",20,4/20/2021,true,false
934,"Cum sociis natoque penatibus et magnis dis parturient montes, nascetur ridiculus mus. Etiam vel augue.",22,6/26/2021,true,true
935,Suspendisse potenti. In eleifend quam a odio. In hac habitasse platea dictumst.,11,7/3/2021,true,true
936,"Aliquam augue quam, sollicitudin vitae, consectetuer eget, rutrum at, lorem. Integer tincidunt ante vel ipsum. Praesent blandit lacinia erat.",10,10/22/2021,false,true
937,Aliquam quis turpis eget elit sodales scelerisque.,8,5/18/2021,false,false
938,Morbi porttitor lorem id ligula. Suspendisse ornare consequat lectus.,9,9/29/2021,false,false
939,Nam nulla.,21,1/20/2021,true,true
940,"Fusce posuere felis sed lacus. Morbi sem mauris, laoreet ut, rhoncus aliquet, pulvinar sed, nisl. Nunc rhoncus dui vel sem.",4,3/4/2021,true,false
941,Nullam molestie nibh in lectus. Pellentesque at nulla.,3,1/8/2021,true,false
942,"Nulla ac enim. In tempor, turpis nec euismod scelerisque, quam turpis adipiscing lorem, vitae mattis nibh ligula nec sem.",5,3/22/2021,true,true
943,"Fusce posuere felis sed lacus. Morbi sem mauris, laoreet ut, rhoncus aliquet, pulvinar sed, nisl.",22,10/30/2021,false,true
944,Duis aliquam convallis nunc. Proin at turpis a pede posuere nonummy. Integer non velit.,21,4/3/2021,true,true
945,"Morbi odio odio, elementum eu, interdum eu, tincidunt in, leo. Maecenas pulvinar lobortis est.",17,10/17/2021,true,false
946,Phasellus in felis. Donec semper sapien a libero.,6,10/11/2021,false,false
947,Pellentesque viverra pede ac diam.,22,11/5/2021,true,true
948,"Morbi vestibulum, velit id pretium iaculis, diam erat fermentum justo, nec condimentum neque sapien placerat ante. Nulla justo.",6,1/20/2021,true,true
949,Sed ante.,12,5/9/2021,false,true
950,Duis aliquam convallis nunc. Proin at turpis a pede posuere nonummy.,20,5/5/2021,true,false
951,In eleifend quam a odio.,1,11/21/2021,true,true
952,Etiam justo.,2,7/5/2021,true,true
953,"Cum sociis natoque penatibus et magnis dis parturient montes, nascetur ridiculus mus. Etiam vel augue.",10,1/30/2021,true,true
954,"Nam nulla. Integer pede justo, lacinia eget, tincidunt eget, tempus vel, pede.",6,9/25/2021,false,false
955,"Morbi vel lectus in quam fringilla rhoncus. Mauris enim leo, rhoncus sed, vestibulum sit amet, cursus id, turpis.",24,6/11/2021,true,true
956,In quis justo. Maecenas rhoncus aliquam lacus. Morbi quis tortor id nulla ultrices aliquet.,7,8/14/2021,false,true
