post_id,body,added_by,date,user_closed,deleted
1,Ut tellus. Nulla ut erat id mauris vulputate elementum. Nullam varius.,11,2/10/2021,true,false
2,Donec dapibus.,10,4/24/2021,true,true
3,"Duis bibendum, felis sed interdum venenatis, turpis enim blandit mi, in porttitor pede justo eu massa. Donec dapibus. Duis at velit eu est congue elementum.",7,3/27/2021,false,true
4,"Donec semper sapien a libero. Nam dui. Proin leo odio, porttitor id, consequat in, consequat ut, nulla.",17,10/27/2021,false,false
5,"Suspendisse ornare consequat lectus. In est risus, auctor sed, tristique in, tempus sit amet, sem.",8,11/19/2021,false,true
6,"Curabitur in libero ut massa volutpat convallis. Morbi odio odio, elementum eu, interdum eu, tincidunt in, leo. Maecenas pulvinar lobortis est.",22,4/27/2021,true,true
7,"Nam nulla. Integer pede justo, lacinia eget, tincidunt eget, tempus vel, pede.",19,5/30/2021,false,false
8,"Donec odio justo, sollicitudin ut, suscipit a, feugiat et, eros. Vestibulum ac est lacinia nisi venenatis tristique.",22,5/6/2021,false,false
9,Quisque id justo sit amet sapien dignissim vestibulum. Vestibulum ante ipsum primis in faucibus orci luctus et ultrices posuere cubilia Curae; Nulla dapibus dolor vel est.,9,1/31/2021,false,true
10,"Duis at velit eu est congue elementum. In hac habitasse platea dictumst. Morbi vestibulum, velit id pretium iaculis, diam erat fermentum justo, nec condimentum neque sapien placerat ante.",15,9/16/2021,true,true
11,In quis justo. Maecenas rhoncus aliquam lacus. Morbi quis tortor id nulla ultrices aliquet.,14,5/19/2021,true,false
12,"Donec vitae nisi. Nam ultrices, libero non mattis pulvinar, nulla pede ullamcorper augue, a suscipit nulla elit ac nulla.",5,6/5/2021,true,false
13,Praesent lectus.,21,11/13/2021,true,true
14,Aliquam quis turpis eget elit sodales scelerisque. Mauris sit amet eros. Suspendisse accumsan tortor quis turpis.,17,8/5/2021,true,false
15,Mauris sit amet eros. Suspendisse accumsan tortor quis turpis.,12,8/19/2021,true,true
16,Maecenas pulvinar lobortis est.,8,5/24/2021,true,true
17,Duis at velit eu est congue elementum. In hac habitasse platea dictumst.,8,7/27/2021,false,false
18,Sed ante. Vivamus tortor. Duis mattis egestas metus.,15,1/9/2021,false,false
19,"Nam dui. Proin leo odio, porttitor id, consequat in, consequat ut, nulla. Sed accumsan felis.",15,1/27/2021,false,true
20,Nulla nisl. Nunc nisl.,8,8/8/2021,true,true
21,In congue.,7,6/26/2021,false,true
22,"Suspendisse potenti. Cras in purus eu magna vulputate luctus. Cum sociis natoque penatibus et magnis dis parturient montes, nascetur ridiculus mus.",2,3/7/2021,false,true
23,Nulla nisl.,16,6/6/2021,true,false
24,Curabitur convallis. Duis consequat dui nec nisi volutpat eleifend. Donec ut dolor.,6,8/22/2021,false,true
25,Aenean sit amet justo.,10,5/25/2021,true,false
26,Pellentesque eget nunc. Donec quis orci eget orci vehicula condimentum.,14,9/8/2021,false,false
27,Etiam vel augue.,10,7/29/2021,false,true
28,In eleifend quam a odio.,3,12/24/2021,true,true
29,Nullam sit amet turpis elementum ligula vehicula consequat.,21,2/18/2021,true,true
30,"Vestibulum ante ipsum primis in faucibus orci luctus et ultrices posuere cubilia Curae; Donec pharetra, magna vestibulum aliquet ultrices, erat tortor sollicitudin mi, sit amet lobortis sapien sapien non mi. Integer ac neque.",10,3/13/2021,true,false
31,"Nam ultrices, libero non mattis pulvinar, nulla pede ullamcorper augue, a suscipit nulla elit ac nulla. Sed vel enim sit amet nunc viverra dapibus.",22,1/25/2021,true,false
32,"Morbi odio odio, elementum eu, interdum eu, tincidunt in, leo.",11,3/10/2021,false,true
33,Nulla suscipit ligula in lacus.,4,8/10/2021,true,true
34,Sed accumsan felis. Ut at dolor quis odio consequat varius.,21,9/27/2021,false,false
35,Curabitur convallis. Duis consequat dui nec nisi volutpat eleifend. Donec ut dolor.,21,6/6/2021,false,false
36,Morbi quis tortor id nulla ultrices aliquet.,8,5/3/2021,false,false
37,Pellentesque viverra pede ac diam.,9,9/6/2021,false,true
38,Nulla suscipit ligula in lacus. Curabitur at ipsum ac tellus semper interdum.,17,2/19/2021,false,true
39,"Nunc rhoncus dui vel sem. Sed sagittis. Nam congue, risus semper porta volutpat, quam pede lobortis ligula, sit amet eleifend pede libero quis orci.",11,8/16/2021,true,false
40,"Nulla nisl. Nunc nisl. Duis bibendum, felis sed interdum venenatis, turpis enim blandit mi, in porttitor pede justo eu massa.",25,12/21/2021,true,false
41,Cras pellentesque volutpat dui.,6,10/27/2021,false,true
42,"Fusce lacus purus, aliquet at, feugiat non, pretium quis, lectus.",22,3/10/2021,true,false
43,"Integer pede justo, lacinia eget, tincidunt eget, tempus vel, pede.",21,10/7/2021,true,true
44,"Morbi quis tortor id nulla ultrices aliquet. Maecenas leo odio, condimentum id, luctus nec, molestie sed, justo. Pellentesque viverra pede ac diam.",13,7/24/2021,false,true
45,Integer ac neque. Duis bibendum. Morbi non quam nec dui luctus rutrum.,3,7/6/2021,false,false
46,Ut tellus. Nulla ut erat id mauris vulputate elementum.,11,11/10/2021,true,true
47,Donec semper sapien a libero. Nam dui.,3,6/20/2021,true,false
48,Vestibulum ante ipsum primis in faucibus orci luctus et ultrices posuere cubilia Curae; Mauris viverra diam vitae quam.,22,6/4/2021,true,false
49,"Vestibulum ante ipsum primis in faucibus orci luctus et ultrices posuere cubilia Curae; Donec pharetra, magna vestibulum aliquet ultrices, erat tortor sollicitudin mi, sit amet lobortis sapien sapien non mi.",17,11/19/2021,true,false
50,"Donec diam neque, vestibulum eget, vulputate ut, ultrices vel, augue. Vestibulum ante ipsum primis in faucibus orci luctus et ultrices posuere cubilia Curae; Donec pharetra, magna vestibulum aliquet ultrices, erat tortor sollicitudin mi, sit amet lobortis sapien sapien non mi.",13,1/29/2021,true,false
51,"Cum sociis natoque penatibus et magnis dis parturient montes, nascetur ridiculus mus. Vivamus vestibulum sagittis sapien. Cum sociis natoque penatibus et magnis dis parturient montes, nascetur ridiculus mus.",15,11/30/2021,false,false
52,"Sed sagittis. Nam congue, risus semper porta volutpat, quam pede lobortis ligula, sit amet eleifend pede libero quis orci.",7,8/22/2021,false,false
53,Nulla suscipit ligula in lacus. Curabitur at ipsum ac tellus semper interdum.,16,7/31/2021,false,true
54,Nulla suscipit ligula in lacus. Curabitur at ipsum ac tellus semper interdum.,16,8/12/2021,true,false
55,Suspendisse accumsan tortor quis turpis.,24,11/15/2021,false,true
56,"Nam nulla. Integer pede justo, lacinia eget, tincidunt eget, tempus vel, pede.",22,4/16/2021,true,true
57,"Curabitur in libero ut massa volutpat convallis. Morbi odio odio, elementum eu, interdum eu, tincidunt in, leo.",22,11/4/2021,false,true
58,Sed ante. Vivamus tortor. Duis mattis egestas metus.,22,3/14/2021,true,true
59,"Fusce lacus purus, aliquet at, feugiat non, pretium quis, lectus. Suspendisse potenti.",15,2/23/2021,true,true
60,Maecenas pulvinar lobortis est.,21,2/10/2021,true,true
61,Pellentesque eget nunc. Donec quis orci eget orci vehicula condimentum.,8,2/12/2021,false,false
62,Morbi quis tortor id nulla ultrices aliquet.,16,11/4/2021,true,false
63,"Duis at velit eu est congue elementum. In hac habitasse platea dictumst. Morbi vestibulum, velit id pretium iaculis, diam erat fermentum justo, nec condimentum neque sapien placerat ante.",17,12/27/2021,true,true
64,Nulla ut erat id mauris vulputate elementum. Nullam varius.,2,4/12/2021,true,false
65,Maecenas tincidunt lacus at velit. Vivamus vel nulla eget eros elementum pellentesque.,8,6/26/2021,true,false
66,Aliquam non mauris. Morbi non lectus. Aliquam sit amet diam in magna bibendum imperdiet.,23,6/30/2021,true,true
67,Aenean lectus.,14,7/28/2021,true,false
68,"Duis ac nibh. Fusce lacus purus, aliquet at, feugiat non, pretium quis, lectus. Suspendisse potenti.",16,10/12/2021,true,true
69,"Donec diam neque, vestibulum eget, vulputate ut, ultrices vel, augue. Vestibulum ante ipsum primis in faucibus orci luctus et ultrices posuere cubilia Curae; Donec pharetra, magna vestibulum aliquet ultrices, erat tortor sollicitudin mi, sit amet lobortis sapien sapien non mi.",19,7/3/2021,false,false
70,Morbi vel lectus in quam fringilla rhoncus.,14,4/15/2021,false,true
71,"Morbi porttitor lorem id ligula. Suspendisse ornare consequat lectus. In est risus, auctor sed, tristique in, tempus sit amet, sem.",7,1/29/2021,true,false
72,Duis mattis egestas metus.,16,11/21/2021,false,true
73,Praesent blandit lacinia erat.,9,1/18/2021,false,true
74,Curabitur convallis. Duis consequat dui nec nisi volutpat eleifend.,11,7/30/2021,true,true
75,Phasellus sit amet erat. Nulla tempus.,15,5/29/2021,false,false
76,Maecenas rhoncus aliquam lacus.,11,2/23/2021,true,true
77,Quisque ut erat.,15,6/22/2021,false,false
78,"Nunc rhoncus dui vel sem. Sed sagittis. Nam congue, risus semper porta volutpat, quam pede lobortis ligula, sit amet eleifend pede libero quis orci.",23,12/25/2021,true,false
79,Curabitur at ipsum ac tellus semper interdum. Mauris ullamcorper purus sit amet nulla.,7,2/9/2021,true,false
80,Nulla tempus. Vivamus in felis eu sapien cursus vestibulum.,13,2/19/2021,true,false
81,"Nunc rhoncus dui vel sem. Sed sagittis. Nam congue, risus semper porta volutpat, quam pede lobortis ligula, sit amet eleifend pede libero quis orci.",15,2/19/2021,true,true
82,"Aliquam sit amet diam in magna bibendum imperdiet. Nullam orci pede, venenatis non, sodales sed, tincidunt eu, felis.",11,1/11/2021,false,true
83,"Pellentesque viverra pede ac diam. Cras pellentesque volutpat dui. Maecenas tristique, est et tempus semper, est quam pharetra magna, ac consequat metus sapien ut nunc.",7,4/21/2021,true,false
84,"Donec odio justo, sollicitudin ut, suscipit a, feugiat et, eros.",7,4/11/2021,true,true
85,Aliquam quis turpis eget elit sodales scelerisque.,6,9/1/2021,true,false
86,Vivamus vel nulla eget eros elementum pellentesque.,10,7/28/2021,true,true
87,"Nunc nisl. Duis bibendum, felis sed interdum venenatis, turpis enim blandit mi, in porttitor pede justo eu massa. Donec dapibus.",16,1/3/2021,false,false
88,"Nulla neque libero, convallis eget, eleifend luctus, ultricies eu, nibh.",5,5/31/2021,true,true
89,"Nam ultrices, libero non mattis pulvinar, nulla pede ullamcorper augue, a suscipit nulla elit ac nulla. Sed vel enim sit amet nunc viverra dapibus.",6,1/28/2021,true,true
90,"Suspendisse ornare consequat lectus. In est risus, auctor sed, tristique in, tempus sit amet, sem.",16,10/30/2021,false,true
91,"Nam ultrices, libero non mattis pulvinar, nulla pede ullamcorper augue, a suscipit nulla elit ac nulla.",1,4/22/2021,false,true
92,Donec dapibus. Duis at velit eu est congue elementum.,25,5/25/2021,false,true
93,"Aliquam sit amet diam in magna bibendum imperdiet. Nullam orci pede, venenatis non, sodales sed, tincidunt eu, felis.",7,1/14/2021,false,false
94,"Duis ac nibh. Fusce lacus purus, aliquet at, feugiat non, pretium quis, lectus. Suspendisse potenti.",2,12/10/2021,true,true
95,Pellentesque ultrices mattis odio.,13,12/18/2021,false,false
96,Duis mattis egestas metus. Aenean fermentum. Donec ut mauris eget massa tempor convallis.,20,4/27/2021,false,true
97,"Morbi porttitor lorem id ligula. Suspendisse ornare consequat lectus. In est risus, auctor sed, tristique in, tempus sit amet, sem.",10,5/20/2021,true,false
98,"Cras in purus eu magna vulputate luctus. Cum sociis natoque penatibus et magnis dis parturient montes, nascetur ridiculus mus.",17,7/4/2021,true,true
99,"Aliquam sit amet diam in magna bibendum imperdiet. Nullam orci pede, venenatis non, sodales sed, tincidunt eu, felis.",4,11/14/2021,true,false
100,"Nulla neque libero, convallis eget, eleifend luctus, ultricies eu, nibh. Quisque id justo sit amet sapien dignissim vestibulum. Vestibulum ante ipsum primis in faucibus orci luctus et ultrices posuere cubilia Curae; Nulla dapibus dolor vel est.",19,5/31/2021,false,false
101,In hac habitasse platea dictumst.,24,1/8/2021,true,true
102,"Aliquam sit amet diam in magna bibendum imperdiet. Nullam orci pede, venenatis non, sodales sed, tincidunt eu, felis. Fusce posuere felis sed lacus.",4,5/31/2021,false,false
103,"Vestibulum ante ipsum primis in faucibus orci luctus et ultrices posuere cubilia Curae; Donec pharetra, magna vestibulum aliquet ultrices, erat tortor sollicitudin mi, sit amet lobortis sapien sapien non mi. Integer ac neque.",25,12/10/2021,true,true
104,"Phasellus id sapien in sapien iaculis congue. Vivamus metus arcu, adipiscing molestie, hendrerit at, vulputate vitae, nisl.",16,10/29/2021,false,true
105,Nulla nisl. Nunc nisl.,7,6/6/2021,false,false
106,"Lorem ipsum dolor sit amet, consectetuer adipiscing elit. Proin interdum mauris non ligula pellentesque ultrices.",25,12/26/2021,false,true
107,"Nulla neque libero, convallis eget, eleifend luctus, ultricies eu, nibh. Quisque id justo sit amet sapien dignissim vestibulum. Vestibulum ante ipsum primis in faucibus orci luctus et ultrices posuere cubilia Curae; Nulla dapibus dolor vel est.",2,6/24/2021,false,false
108,"Donec ut mauris eget massa tempor convallis. Nulla neque libero, convallis eget, eleifend luctus, ultricies eu, nibh.",6,4/7/2021,false,false
109,"Fusce posuere felis sed lacus. Morbi sem mauris, laoreet ut, rhoncus aliquet, pulvinar sed, nisl.",11,2/28/2021,false,true
110,Duis ac nibh.,10,5/27/2021,false,true
111,"Fusce posuere felis sed lacus. Morbi sem mauris, laoreet ut, rhoncus aliquet, pulvinar sed, nisl. Nunc rhoncus dui vel sem.",19,7/10/2021,true,false
112,Nunc rhoncus dui vel sem. Sed sagittis.,15,3/21/2021,false,true
113,Nulla suscipit ligula in lacus. Curabitur at ipsum ac tellus semper interdum.,5,8/31/2021,false,true
114,Integer a nibh. In quis justo.,4,2/11/2021,true,false
115,Aenean auctor gravida sem.,4,3/22/2021,true,true
116,"Mauris enim leo, rhoncus sed, vestibulum sit amet, cursus id, turpis.",11,10/5/2021,false,true
117,Donec ut mauris eget massa tempor convallis.,7,3/17/2021,false,false
118,Fusce consequat.,24,9/18/2021,false,true
119,"Nam dui. Proin leo odio, porttitor id, consequat in, consequat ut, nulla.",7,9/3/2021,false,false
120,Duis mattis egestas metus. Aenean fermentum. Donec ut mauris eget massa tempor convallis.,15,11/20/2021,false,false
121,Fusce consequat.,4,8/15/2021,true,true
122,Quisque ut erat.,12,12/19/2021,true,false
123,"Cum sociis natoque penatibus et magnis dis parturient montes, nascetur ridiculus mus. Vivamus vestibulum sagittis sapien.",18,10/29/2021,true,true
124,Vestibulum sed magna at nunc commodo placerat. Praesent blandit.,16,11/3/2021,true,false
125,"Morbi sem mauris, laoreet ut, rhoncus aliquet, pulvinar sed, nisl. Nunc rhoncus dui vel sem.",25,9/1/2021,false,true
126,"Morbi vel lectus in quam fringilla rhoncus. Mauris enim leo, rhoncus sed, vestibulum sit amet, cursus id, turpis.",16,4/3/2021,true,false
127,"Morbi quis tortor id nulla ultrices aliquet. Maecenas leo odio, condimentum id, luctus nec, molestie sed, justo. Pellentesque viverra pede ac diam.",25,3/16/2021,true,true
128,Duis mattis egestas metus.,16,10/13/2021,true,false
129,"Nulla nisl. Nunc nisl. Duis bibendum, felis sed interdum venenatis, turpis enim blandit mi, in porttitor pede justo eu massa.",22,1/25/2021,true,false
130,Donec semper sapien a libero. Nam dui.,21,11/1/2021,false,false
131,Vestibulum sed magna at nunc commodo placerat. Praesent blandit. Nam nulla.,11,11/20/2021,true,true
132,Integer a nibh.,23,4/12/2021,false,true
133,"Proin eu mi. Nulla ac enim. In tempor, turpis nec euismod scelerisque, quam turpis adipiscing lorem, vitae mattis nibh ligula nec sem.",7,8/21/2021,false,false
134,"Nulla neque libero, convallis eget, eleifend luctus, ultricies eu, nibh.",13,2/9/2021,true,true
135,Sed vel enim sit amet nunc viverra dapibus. Nulla suscipit ligula in lacus. Curabitur at ipsum ac tellus semper interdum.,2,1/25/2021,false,true
136,Nam nulla.,11,10/23/2021,false,false
137,In eleifend quam a odio. In hac habitasse platea dictumst. Maecenas ut massa quis augue luctus tincidunt.,2,1/18/2021,true,true
138,"Quisque id justo sit amet sapien dignissim vestibulum. Vestibulum ante ipsum primis in faucibus orci luctus et ultrices posuere cubilia Curae; Nulla dapibus dolor vel est. Donec odio justo, sollicitudin ut, suscipit a, feugiat et, eros.",17,8/20/2021,true,true
139,Duis consequat dui nec nisi volutpat eleifend. Donec ut dolor.,16,7/19/2021,false,false
140,"Curabitur in libero ut massa volutpat convallis. Morbi odio odio, elementum eu, interdum eu, tincidunt in, leo. Maecenas pulvinar lobortis est.",18,7/5/2021,true,false
141,Aliquam quis turpis eget elit sodales scelerisque. Mauris sit amet eros.,22,8/1/2021,false,true
142,Vestibulum sed magna at nunc commodo placerat. Praesent blandit. Nam nulla.,9,6/5/2021,true,false
143,Aenean auctor gravida sem.,11,6/8/2021,true,true
144,"Mauris ullamcorper purus sit amet nulla. Quisque arcu libero, rutrum ac, lobortis vel, dapibus at, diam. Nam tristique tortor eu pede.",6,2/25/2021,true,true
145,In eleifend quam a odio. In hac habitasse platea dictumst. Maecenas ut massa quis augue luctus tincidunt.,17,5/29/2021,false,true
146,Phasellus in felis. Donec semper sapien a libero.,8,10/1/2021,false,false
147,Pellentesque eget nunc. Donec quis orci eget orci vehicula condimentum. Curabitur in libero ut massa volutpat convallis.,12,4/18/2021,true,false
148,Donec semper sapien a libero. Nam dui.,17,6/19/2021,false,true
149,Suspendisse potenti. In eleifend quam a odio.,15,12/10/2021,false,false
150,"In hac habitasse platea dictumst. Morbi vestibulum, velit id pretium iaculis, diam erat fermentum justo, nec condimentum neque sapien placerat ante.",25,3/11/2021,true,true
151,Proin at turpis a pede posuere nonummy. Integer non velit.,9,10/20/2021,true,false
152,"Cum sociis natoque penatibus et magnis dis parturient montes, nascetur ridiculus mus. Etiam vel augue. Vestibulum rutrum rutrum neque.",7,7/18/2021,true,true
153,Vestibulum ante ipsum primis in faucibus orci luctus et ultrices posuere cubilia Curae; Mauris viverra diam vitae quam.,8,5/17/2021,false,true
154,"Nulla ac enim. In tempor, turpis nec euismod scelerisque, quam turpis adipiscing lorem, vitae mattis nibh ligula nec sem.",12,6/14/2021,true,true
155,"Phasellus id sapien in sapien iaculis congue. Vivamus metus arcu, adipiscing molestie, hendrerit at, vulputate vitae, nisl.",24,7/13/2021,false,true
156,Praesent blandit. Nam nulla.,4,12/11/2021,true,true
157,"Integer non velit. Donec diam neque, vestibulum eget, vulputate ut, ultrices vel, augue. Vestibulum ante ipsum primis in faucibus orci luctus et ultrices posuere cubilia Curae; Donec pharetra, magna vestibulum aliquet ultrices, erat tortor sollicitudin mi, sit amet lobortis sapien sapien non mi.",1,1/6/2021,false,true
158,"Vivamus metus arcu, adipiscing molestie, hendrerit at, vulputate vitae, nisl.",15,11/22/2021,true,true
159,Cras in purus eu magna vulputate luctus.,4,6/18/2021,true,false
160,Ut at dolor quis odio consequat varius.,16,2/13/2021,false,false
161,Aliquam non mauris. Morbi non lectus. Aliquam sit amet diam in magna bibendum imperdiet.,2,7/25/2021,false,false
162,"In blandit ultrices enim. Lorem ipsum dolor sit amet, consectetuer adipiscing elit. Proin interdum mauris non ligula pellentesque ultrices.",6,1/29/2021,true,true
163,Nulla suscipit ligula in lacus.,24,11/17/2021,true,true
164,"Quisque porta volutpat erat. Quisque erat eros, viverra eget, congue eget, semper rutrum, nulla. Nunc purus.",16,10/15/2021,false,true
165,Mauris sit amet eros.,15,4/11/2021,false,true
166,"Praesent blandit. Nam nulla. Integer pede justo, lacinia eget, tincidunt eget, tempus vel, pede.",2,7/15/2021,true,true
167,Fusce posuere felis sed lacus.,16,11/28/2021,false,false
168,In quis justo. Maecenas rhoncus aliquam lacus.,23,11/16/2021,true,true
169,"Cras mi pede, malesuada in, imperdiet et, commodo vulputate, justo. In blandit ultrices enim.",4,10/24/2021,true,false
170,Suspendisse accumsan tortor quis turpis. Sed ante.,19,11/26/2021,false,true
171,Etiam pretium iaculis justo. In hac habitasse platea dictumst.,9,1/16/2021,false,true
172,Vivamus in felis eu sapien cursus vestibulum. Proin eu mi.,9,1/26/2021,false,false
173,Suspendisse potenti. Nullam porttitor lacus at turpis. Donec posuere metus vitae ipsum.,1,12/31/2020,true,true
174,Maecenas ut massa quis augue luctus tincidunt. Nulla mollis molestie lorem.,15,12/26/2021,true,true
175,"Cras mi pede, malesuada in, imperdiet et, commodo vulputate, justo.",3,7/16/2021,true,true
176,Duis mattis egestas metus.,13,9/6/2021,false,false
177,Donec posuere metus vitae ipsum. Aliquam non mauris. Morbi non lectus.,17,4/11/2021,true,false
178,Nulla mollis molestie lorem.,3,2/3/2021,false,true
179,"In tempor, turpis nec euismod scelerisque, quam turpis adipiscing lorem, vitae mattis nibh ligula nec sem. Duis aliquam convallis nunc.",18,7/15/2021,false,true
180,Vivamus in felis eu sapien cursus vestibulum. Proin eu mi.,8,2/16/2021,false,false
181,"Quisque erat eros, viverra eget, congue eget, semper rutrum, nulla. Nunc purus. Phasellus in felis.",13,2/2/2021,true,false
182,Donec posuere metus vitae ipsum.,18,6/11/2021,true,false
183,Phasellus in felis. Donec semper sapien a libero. Nam dui.,18,12/28/2020,false,true
184,"Morbi sem mauris, laoreet ut, rhoncus aliquet, pulvinar sed, nisl.",18,9/15/2021,false,false
185,Aliquam non mauris.,12,5/18/2021,true,false
186,Proin at turpis a pede posuere nonummy. Integer non velit.,12,1/20/2021,false,false
187,"Maecenas tristique, est et tempus semper, est quam pharetra magna, ac consequat metus sapien ut nunc. Vestibulum ante ipsum primis in faucibus orci luctus et ultrices posuere cubilia Curae; Mauris viverra diam vitae quam. Suspendisse potenti.",21,5/7/2021,false,true
188,Maecenas ut massa quis augue luctus tincidunt.,7,9/30/2021,false,false
189,"Quisque porta volutpat erat. Quisque erat eros, viverra eget, congue eget, semper rutrum, nulla.",16,11/4/2021,false,false
190,"Proin leo odio, porttitor id, consequat in, consequat ut, nulla.",19,8/23/2021,true,true
191,Donec ut mauris eget massa tempor convallis.,10,12/29/2020,true,false
192,Sed accumsan felis.,11,3/23/2021,true,false
193,"Phasellus id sapien in sapien iaculis congue. Vivamus metus arcu, adipiscing molestie, hendrerit at, vulputate vitae, nisl.",18,6/13/2021,false,false
194,"Lorem ipsum dolor sit amet, consectetuer adipiscing elit. Proin risus.",18,4/11/2021,true,true
195,Suspendisse accumsan tortor quis turpis. Sed ante.,11,7/4/2021,false,false
196,Ut tellus. Nulla ut erat id mauris vulputate elementum. Nullam varius.,16,9/27/2021,true,true
197,"Integer pede justo, lacinia eget, tincidunt eget, tempus vel, pede. Morbi porttitor lorem id ligula. Suspendisse ornare consequat lectus.",21,2/27/2021,true,false
198,"Vestibulum ac est lacinia nisi venenatis tristique. Fusce congue, diam id ornare imperdiet, sapien urna pretium nisl, ut volutpat sapien arcu sed augue.",22,6/22/2021,false,true
199,Praesent lectus.,20,5/24/2021,true,true
200,Integer ac leo. Pellentesque ultrices mattis odio. Donec vitae nisi.,22,6/18/2021,false,true
201,Etiam vel augue. Vestibulum rutrum rutrum neque. Aenean auctor gravida sem.,15,5/4/2021,false,false
202,Praesent lectus.,19,8/29/2021,true,false
203,"Cum sociis natoque penatibus et magnis dis parturient montes, nascetur ridiculus mus. Vivamus vestibulum sagittis sapien. Cum sociis natoque penatibus et magnis dis parturient montes, nascetur ridiculus mus.",1,4/22/2021,false,true
204,Morbi porttitor lorem id ligula.,7,5/7/2021,false,false
205,"Morbi quis tortor id nulla ultrices aliquet. Maecenas leo odio, condimentum id, luctus nec, molestie sed, justo.",8,5/14/2021,true,false
206,"Proin leo odio, porttitor id, consequat in, consequat ut, nulla.",10,8/13/2021,false,false
207,Morbi a ipsum. Integer a nibh. In quis justo.,1,7/24/2021,true,true
208,Donec posuere metus vitae ipsum.,6,12/4/2021,true,true
209,"Integer non velit. Donec diam neque, vestibulum eget, vulputate ut, ultrices vel, augue. Vestibulum ante ipsum primis in faucibus orci luctus et ultrices posuere cubilia Curae; Donec pharetra, magna vestibulum aliquet ultrices, erat tortor sollicitudin mi, sit amet lobortis sapien sapien non mi.",7,5/3/2021,false,true
210,Aliquam non mauris. Morbi non lectus.,12,8/5/2021,true,false
211,"Donec diam neque, vestibulum eget, vulputate ut, ultrices vel, augue. Vestibulum ante ipsum primis in faucibus orci luctus et ultrices posuere cubilia Curae; Donec pharetra, magna vestibulum aliquet ultrices, erat tortor sollicitudin mi, sit amet lobortis sapien sapien non mi. Integer ac neque.",19,10/6/2021,false,true
212,In sagittis dui vel nisl.,3,2/12/2021,false,false
213,Donec ut dolor. Morbi vel lectus in quam fringilla rhoncus.,12,10/17/2021,true,false
214,Suspendisse potenti.,4,12/24/2021,false,false
215,Ut at dolor quis odio consequat varius.,1,12/21/2021,true,false
216,"Donec ut mauris eget massa tempor convallis. Nulla neque libero, convallis eget, eleifend luctus, ultricies eu, nibh. Quisque id justo sit amet sapien dignissim vestibulum.",1,3/5/2021,true,false
217,Integer non velit.,7,4/1/2021,false,false
218,"Donec vitae nisi. Nam ultrices, libero non mattis pulvinar, nulla pede ullamcorper augue, a suscipit nulla elit ac nulla. Sed vel enim sit amet nunc viverra dapibus.",15,1/20/2021,false,false
219,Donec ut mauris eget massa tempor convallis.,4,9/16/2021,false,false
220,Nullam porttitor lacus at turpis.,10,5/16/2021,false,false
221,"Donec ut dolor. Morbi vel lectus in quam fringilla rhoncus. Mauris enim leo, rhoncus sed, vestibulum sit amet, cursus id, turpis.",1,12/13/2021,true,true
222,Morbi non quam nec dui luctus rutrum. Nulla tellus. In sagittis dui vel nisl.,11,2/21/2021,false,true
223,Praesent id massa id nisl venenatis lacinia. Aenean sit amet justo.,20,10/13/2021,true,false
224,"Cras pellentesque volutpat dui. Maecenas tristique, est et tempus semper, est quam pharetra magna, ac consequat metus sapien ut nunc.",21,9/27/2021,true,false
225,Aliquam erat volutpat. In congue.,8,5/16/2021,true,true
